number,value,datetime_start,datetime_complete,duration,params_chunk_size,params_embedding_model,params_overlap_ratio,params_similarity_threshold,params_top_k,params_use_reranker,user_attrs_avg_doc_mrr_in_scope_macro,user_attrs_avg_doc_mrr_in_scope_micro,user_attrs_avg_doc_recall_in_scope_macro,user_attrs_avg_doc_recall_in_scope_micro,user_attrs_avg_mrr_in_scope_macro,user_attrs_avg_mrr_in_scope_micro,user_attrs_avg_ndcg_in_scope_macro,user_attrs_avg_ndcg_in_scope_micro,user_attrs_avg_precision_in_scope_macro,user_attrs_avg_precision_in_scope_micro,user_attrs_avg_recall_in_scope_macro,user_attrs_avg_recall_in_scope_micro,user_attrs_avg_score_hors_perimetre,user_attrs_avg_score_in_scope_macro,user_attrs_avg_score_v3_replica,user_attrs_constraint,user_attrs_duration_seconds,user_attrs_embedding_dim,user_attrs_hors_perimetre_constraint_satisfied,user_attrs_hors_perimetre_min_required,user_attrs_num_chunks,user_attrs_num_docs_in_scope_evaluated,user_attrs_num_questions_evaluated,user_attrs_pruned_early,user_attrs_score_max,user_attrs_score_min,user_attrs_score_std,user_attrs_score_variants,user_attrs_trial_number,system_attrs_constraints,state
187,0.612553943452381,2026-07-22 20:01:04.805922,2026-07-22 20:02:21.771589,0 days 00:01:16.965667,800,arctic-l,0.0,0.522462007593079,2,True,0.7768229166666667,0.7621951219512195,0.7833333333333333,0.8048780487804879,0.6913318452380952,0.6707317073170732,0.7029828911930956,0.7003461119751203,0.40282738095238096,0.39634146341463417,0.7431547619047619,0.7317073170731707,0.48,0.612553943452381,0.5587121212121212,[0.020000000000000018],76.79,1024.0,False,0.5,11198.0,16.0,132.0,False,1.0,0.0,0.3751140021042376,"{'v4': {'micro': 0.5975609756097562, 'macro': 0.612553943452381}, 'v3_legacy': {'micro': 0.6067073170731707, 'macro': 0.6203273809523809}, 'equal': {'micro': 0.5995934959349594, 'macro': 0.612437996031746}, 'mrr_only': {'micro': 0.6707317073170732, 'macro': 0.6913318452380952}}",187.0,[0.020000000000000018],COMPLETE
188,0.569164806547619,2026-07-22 20:02:21.786309,2026-07-22 20:02:47.376906,0 days 00:00:25.590597,800,arctic-l,0.0,0.5704254837241417,2,True,0.6798735119047619,0.6585365853658537,0.6785714285714286,0.6951219512195121,0.6084449404761905,0.5853658536585366,0.6414590483723996,0.6167214273519206,0.45212053571428573,0.4146341463414634,0.6592261904761905,0.6463414634146342,0.74,0.569164806547619,0.6234848484848484,[-0.24],25.42,1024.0,True,0.5,11198.0,16.0,132.0,False,1.0,0.0,0.41807574549458226,"{'v4': {'micro': 0.5432926829268293, 'macro': 0.569164806547619}, 'v3_legacy': {'micro': 0.5524390243902438, 'macro': 0.5767819940476191}, 'equal': {'micro': 0.5487804878048781, 'macro': 0.5732638888888888}, 'mrr_only': {'micro': 0.5853658536585366, 'macro': 0.6084449404761905}}",188.0,[-0.24],COMPLETE
189,0.4956529017857143,2026-07-22 20:02:47.391104,2026-07-22 20:03:24.829085,0 days 00:00:37.437981,256,arctic-l,0.0,0.5439967012631802,2,True,0.7509672619047619,0.75,0.7483630952380952,0.774390243902439,0.5485491071428571,0.5609756097560976,0.5953306360526822,0.6427807713403509,0.35595238095238096,0.3780487804878049,0.5811011904761905,0.5975609756097561,0.52,0.4956529017857143,0.5181818181818182,[-0.020000000000000018],37.28,1024.0,True,0.5,28876.0,16.0,132.0,False,1.0,0.0,0.43050939626638424,"{'v4': {'micro': 0.5115853658536585, 'macro': 0.4956529017857143}, 'v3_legacy': {'micro': 0.5170731707317073, 'macro': 0.5005357142857143}, 'equal': {'micro': 0.5121951219512195, 'macro': 0.4952008928571428}, 'mrr_only': {'micro': 0.5609756097560976, 'macro': 0.5485491071428571}}",189.0,[-0.020000000000000018],COMPLETE
190,,2026-07-22 20:03:24.842868,2026-07-22 20:03:32.546277,0 days 00:00:07.703409,800,bge-m3,0.0,0.586509269494524,1,True,,,,,,,,,,,,,,,,[0.5],,,,,,,,,,,,,,[0.5],PRUNED
191,0.5887630208333334,2026-07-22 20:03:32.554772,2026-07-22 20:04:15.256061,0 days 00:00:42.701289,800,arctic-l,0.0,0.5505440506812292,2,True,0.7303943452380952,0.7073170731707317,0.7431547619047619,0.7560975609756098,0.6459449404761904,0.6219512195121951,0.6643534063726227,0.6594767499553331,0.42421875,0.4146341463414634,0.7081845238095238,0.6951219512195121,0.6,0.5887630208333334,0.5886363636363636,[-0.09999999999999998],42.54,1024.0,True,0.5,11198.0,16.0,132.0,False,1.0,0.0,0.39543517395336003,"{'v4': {'micro': 0.5707317073170732, 'macro': 0.5887630208333334}, 'v3_legacy': {'micro': 0.5817073170731708, 'macro': 0.5980989583333334}, 'equal': {'micro': 0.5772357723577235, 'macro': 0.5927827380952381}, 'mrr_only': {'micro': 0.6219512195121951, 'macro': 0.6459449404761904}}",191.0,[-0.09999999999999998],COMPLETE
192,0.5678255208333334,2026-07-22 20:04:15.270228,2026-07-22 20:04:44.386682,0 days 00:00:29.116454,800,arctic-l,0.0,0.5662258693424868,2,True,0.6824776785714286,0.6585365853658537,0.6837797619047619,0.6951219512195121,0.6084449404761905,0.5853658536585366,0.6414590483723996,0.6167214273519206,0.44765625,0.40853658536585363,0.6592261904761905,0.6463414634146342,0.7,0.5678255208333334,0.6071969696969698,[-0.19999999999999996],28.95,1024.0,True,0.5,11198.0,16.0,132.0,False,1.0,0.0,0.41639823794529923,"{'v4': {'micro': 0.5414634146341464, 'macro': 0.5678255208333334}, 'v3_legacy': {'micro': 0.5506097560975609, 'macro': 0.5754427083333333}, 'equal': {'micro': 0.5467479674796747, 'macro': 0.5717757936507936}, 'mrr_only': {'micro': 0.5853658536585366, 'macro': 0.6084449404761905}}",192.0,[-0.19999999999999996],COMPLETE
193,0.5916052827380953,2026-07-22 20:04:44.400614,2026-07-22 20:05:50.802515,0 days 00:01:06.401901,800,arctic-l,0.0,0.5305322277360295,2,True,0.7591145833333334,0.7439024390243902,0.7604166666666666,0.7804878048780488,0.6620907738095239,0.6402439024390244,0.6798173139061048,0.6761727285703154,0.39732142857142855,0.3902439024390244,0.7217261904761905,0.7073170731707317,0.52,0.5916052827380953,0.5606060606060606,[-0.020000000000000018],66.24,1024.0,True,0.5,11198.0,16.0,132.0,False,1.0,0.0,0.38444396619915416,"{'v4': {'micro': 0.5753048780487805, 'macro': 0.5916052827380953}, 'v3_legacy': {'micro': 0.5853658536585366, 'macro': 0.6005505952380953}, 'equal': {'micro': 0.5792682926829268, 'macro': 0.5937127976190476}, 'mrr_only': {'micro': 0.6402439024390244, 'macro': 0.6620907738095239}}",193.0,[-0.020000000000000018],COMPLETE
194,0.6138560267857144,2026-07-22 20:05:50.816551,2026-07-22 20:07:18.384184,0 days 00:01:27.567633,800,arctic-l,0.0,0.5107790048903477,2,True,0.7690104166666667,0.7560975609756098,0.7572916666666667,0.7804878048780488,0.6965401785714286,0.676829268292683,0.7068273729267264,0.704846968638883,0.3976190476190476,0.3902439024390244,0.7431547619047619,0.7317073170731707,0.36,0.6138560267857144,0.5136363636363637,[0.14],87.41,1024.0,False,0.5,11198.0,16.0,132.0,False,1.0,0.0,0.374541286962466,"{'v4': {'micro': 0.5990853658536586, 'macro': 0.6138560267857144}, 'v3_legacy': {'micro': 0.6073170731707317, 'macro': 0.6208482142857142}, 'equal': {'micro': 0.5995934959349594, 'macro': 0.612437996031746}, 'mrr_only': {'micro': 0.676829268292683, 'macro': 0.6965401785714286}}",194.0,[0.14],COMPLETE
195,0.5655028521825397,2026-07-22 20:07:18.398457,2026-07-22 20:08:28.476541,0 days 00:01:10.078084,800,arctic-l,0.0,0.5276724049903568,10,True,0.7841145833333333,0.7697154471544716,0.8895833333333334,0.8902439024390244,0.6929935515873016,0.6682926829268292,0.755847746342766,0.7419182848525067,0.21355406746031746,0.19938056523422376,0.8019345238095238,0.7804878048780488,0.5,0.5655028521825397,0.538066378066378,[0.0],69.92,1024.0,True,0.5,11198.0,16.0,132.0,False,1.0,0.0,0.32437852695343045,"{'v4': {'micro': 0.5444483159117306, 'macro': 0.5655028521825397}, 'v3_legacy': {'micro': 0.5612775842044134, 'macro': 0.5818439980158729}, 'equal': {'micro': 0.5493870176797006, 'macro': 0.5694940476190475}, 'mrr_only': {'micro': 0.6682926829268292, 'macro': 0.6929935515873016}}",195.0,[0.0],COMPLETE
196,,2026-07-22 20:08:28.490685,2026-07-22 20:08:36.510012,0 days 00:00:08.019327,800,arctic-l,0.25,0.5356129548924047,2,False,,,,,,,,,,,,,,,,[0.5],,,,,,,,,,,,,,[0.5],PRUNED
197,0.38833333333333336,2026-07-22 20:08:36.517992,2026-07-22 20:08:56.738747,0 days 00:00:20.220755,800,miniLM,0.0,0.5774527016712042,2,True,0.525,0.5666666666666667,0.525,0.5666666666666667,0.375,0.43333333333333335,0.44463946303571866,0.48412396714286104,0.25,0.26666666666666666,0.4,0.4666666666666667,0.0,0.34125000000000005,0.28095238095238095,[0.5],20.05,384.0,False,0.5,11198.0,10.0,21.0,True,1.0,0.0,0.42277522265252127,"{'v4': {'micro': 0.38833333333333336, 'macro': 0.34125000000000005}, 'v3_legacy': {'micro': 0.39333333333333337, 'macro': 0.34500000000000003}, 'equal': {'micro': 0.3888888888888889, 'macro': 0.3416666666666667}, 'mrr_only': {'micro': 0.43333333333333335, 'macro': 0.375}}",197.0,[0.5],PRUNED
198,0.5810026041666667,2026-07-22 20:08:56.747242,2026-07-22 20:09:33.257105,0 days 00:00:36.509863,800,arctic-l,0.0,0.5575711554256023,2,True,0.7262276785714286,0.7012195121951219,0.7327380952380952,0.7439024390243902,0.6261532738095238,0.6036585365853658,0.6605312333054357,0.636610814590597,0.44765625,0.4146341463414634,0.6821428571428572,0.6707317073170732,0.62,0.5810026041666667,0.5871212121212122,[-0.12],36.32,1024.0,True,0.5,11198.0,16.0,132.0,False,1.0,0.0,0.4071441733588478,"{'v4': {'micro': 0.5570121951219513, 'macro': 0.5810026041666667}, 'v3_legacy': {'micro': 0.5670731707317073, 'macro': 0.5894010416666666}, 'equal': {'micro': 0.5630081300813008, 'macro': 0.5853174603174602}, 'mrr_only': {'micro': 0.6036585365853658, 'macro': 0.6261532738095238}}",198.0,[-0.12],COMPLETE
199,,2026-07-22 20:09:33.272375,2026-07-22 20:09:43.851153,0 days 00:00:10.578778,1024,arctic-l,0.0,0.540777721364768,2,True,,,,,,,,,,,,,,,,[0.5],,,,,,,,,,,,,,[0.5],PRUNED
200,0.5150558035714287,2026-07-22 20:09:43.859918,2026-07-22 20:11:32.036212,0 days 00:01:48.176294,512,e5-base,0.0,0.5162277782596594,2,True,0.678422619047619,0.6463414634146342,0.6601934523809524,0.6585365853658537,0.5810267857142857,0.5609756097560976,0.6059060670918485,0.6090271620644638,0.3423735119047619,0.3353658536585366,0.6185267857142857,0.5975609756097561,0.0,0.5150558035714287,0.3132575757575758,[0.5],108.01,768.0,False,0.5,15721.0,16.0,132.0,False,1.0,0.0,0.4178360054185761,"{'v4': {'micro': 0.4987804878048781, 'macro': 0.5150558035714287}, 'v3_legacy': {'micro': 0.5042682926829268, 'macro': 0.5206808035714285}, 'equal': {'micro': 0.4979674796747967, 'macro': 0.5139756944444445}, 'mrr_only': {'micro': 0.5609756097560976, 'macro': 0.5810267857142857}}",200.0,[0.5],COMPLETE
201,0.5965755208333334,2026-07-22 20:11:32.049952,2026-07-22 20:12:16.367138,0 days 00:00:44.317186,800,arctic-l,0.0,0.5525213579698275,2,True,0.7303943452380952,0.7073170731707317,0.7431547619047619,0.7560975609756098,0.6459449404761904,0.6219512195121951,0.6819595218917456,0.6565002018292733,0.45026041666666666,0.4146341463414634,0.7081845238095238,0.6951219512195121,0.6,0.5965755208333334,0.5886363636363636,[-0.09999999999999998],44.15,1024.0,True,0.5,11198.0,16.0,132.0,False,1.0,0.0,0.39543517395336003,"{'v4': {'micro': 0.5707317073170732, 'macro': 0.5965755208333334}, 'v3_legacy': {'micro': 0.5817073170731708, 'macro': 0.6059114583333334}, 'equal': {'micro': 0.5772357723577235, 'macro': 0.6014632936507937}, 'mrr_only': {'micro': 0.6219512195121951, 'macro': 0.6459449404761904}}",201.0,[-0.09999999999999998],COMPLETE
202,0.5678255208333334,2026-07-22 20:12:16.380980,2026-07-22 20:12:45.162407,0 days 00:00:28.781427,800,arctic-l,0.0,0.5665005647195844,2,True,0.6824776785714286,0.6585365853658537,0.6837797619047619,0.6951219512195121,0.6084449404761905,0.5853658536585366,0.6414590483723996,0.6167214273519206,0.44765625,0.40853658536585363,0.6592261904761905,0.6463414634146342,0.7,0.5678255208333334,0.6071969696969698,[-0.19999999999999996],28.62,1024.0,True,0.5,11198.0,16.0,132.0,False,1.0,0.0,0.41639823794529923,"{'v4': {'micro': 0.5414634146341464, 'macro': 0.5678255208333334}, 'v3_legacy': {'micro': 0.5506097560975609, 'macro': 0.5754427083333333}, 'equal': {'micro': 0.5467479674796747, 'macro': 0.5717757936507936}, 'mrr_only': {'micro': 0.5853658536585366, 'macro': 0.6084449404761905}}",202.0,[-0.19999999999999996],COMPLETE
203,0.5801692708333334,2026-07-22 20:12:45.176316,2026-07-22 20:13:35.828074,0 days 00:00:50.651758,800,arctic-l,0.0,0.5446296265574719,2,True,0.7356026785714286,0.7134146341463414,0.7431547619047619,0.7560975609756098,0.6459449404761904,0.6219512195121951,0.6616257031732173,0.6562833413316391,0.40078125,0.39634146341463417,0.6977678571428572,0.6829268292682927,0.58,0.5801692708333334,0.5753787878787879,[-0.07999999999999996],50.49,1024.0,True,0.5,11198.0,16.0,132.0,False,1.0,0.0,0.3983042393735158,"{'v4': {'micro': 0.5634146341463415, 'macro': 0.5801692708333334}, 'v3_legacy': {'micro': 0.5725609756097562, 'macro': 0.5879427083333333}, 'equal': {'micro': 0.5670731707317073, 'macro': 0.5814980158730159}, 'mrr_only': {'micro': 0.6219512195121951, 'macro': 0.6459449404761904}}",203.0,[-0.07999999999999996],COMPLETE
204,0.5900427827380953,2026-07-22 20:13:35.841776,2026-07-22 20:14:45.379091,0 days 00:01:09.537315,800,arctic-l,0.0,0.5287810693588764,2,True,0.7591145833333334,0.7439024390243902,0.7604166666666666,0.7804878048780488,0.6620907738095239,0.6402439024390244,0.6757875971640783,0.6714550114089186,0.39211309523809523,0.38414634146341464,0.7217261904761905,0.7073170731707317,0.52,0.5900427827380953,0.559469696969697,[-0.020000000000000018],69.38,1024.0,True,0.5,11198.0,16.0,132.0,False,1.0,0.0,0.38277205295980954,"{'v4': {'micro': 0.5734756097560977, 'macro': 0.5900427827380953}, 'v3_legacy': {'micro': 0.5835365853658536, 'macro': 0.5989880952380953}, 'equal': {'micro': 0.5772357723577235, 'macro': 0.5919766865079364}, 'mrr_only': {'micro': 0.6402439024390244, 'macro': 0.6620907738095239}}",204.0,[-0.020000000000000018],COMPLETE
205,0.6049646577380953,2026-07-22 20:14:45.392806,2026-07-22 20:15:56.997425,0 days 00:01:11.604619,800,arctic-l,0.0,0.5263871722315634,2,True,0.7716145833333333,0.7560975609756098,0.7729166666666667,0.7926829268292683,0.6824032738095238,0.6585365853658537,0.6940543197645243,0.6881509900239008,0.3983630952380952,0.3902439024390244,0.7342261904761904,0.7195121951219512,0.5,0.6049646577380953,0.5598484848484849,[0.0],71.45,1024.0,True,0.5,11198.0,16.0,132.0,False,1.0,0.0,0.3797111366463694,"{'v4': {'micro': 0.5871951219512196, 'macro': 0.6049646577380953}, 'v3_legacy': {'micro': 0.5963414634146341, 'macro': 0.6127380952380952}, 'equal': {'micro': 0.589430894308943, 'macro': 0.6049975198412698}, 'mrr_only': {'micro': 0.6585365853658537, 'macro': 0.6824032738095238}}",205.0,[0.0],COMPLETE
206,,2026-07-22 20:15:57.011399,2026-07-22 20:16:48.835508,0 days 00:00:51.824109,800,arctic-l,0.4,0.4969185478508051,2,True,,,,,,,,,,,,,,,,[0.5],,,,,,,,,,,,,,[0.5],PRUNED
207,0.612553943452381,2026-07-22 20:16:48.844463,2026-07-22 20:18:00.932056,0 days 00:01:12.087593,800,arctic-l,0.0,0.5259095839074265,2,True,0.7716145833333333,0.7560975609756098,0.7729166666666667,0.7926829268292683,0.6913318452380952,0.6707317073170732,0.7029828911930956,0.7003461119751203,0.40282738095238096,0.39634146341463417,0.7431547619047619,0.7317073170731707,0.5,0.612553943452381,0.5662878787878788,[0.0],71.93,1024.0,True,0.5,11198.0,16.0,132.0,False,1.0,0.0,0.3751140021042376,"{'v4': {'micro': 0.5975609756097562, 'macro': 0.612553943452381}, 'v3_legacy': {'micro': 0.6067073170731707, 'macro': 0.6203273809523809}, 'equal': {'micro': 0.5995934959349594, 'macro': 0.612437996031746}, 'mrr_only': {'micro': 0.6707317073170732, 'macro': 0.6913318452380952}}",207.0,[0.0],COMPLETE
208,0.6395089285714286,2026-07-22 20:18:00.945579,2026-07-22 20:19:10.786522,0 days 00:01:09.840943,800,arctic-l,0.0,0.5255051002468465,1,True,0.7286458333333333,0.7073170731707317,0.6765625,0.6890243902439024,0.6395089285714286,0.6097560975609756,0.6395089285714286,0.6097560975609756,0.6395089285714286,0.6097560975609756,0.6395089285714286,0.6097560975609756,0.5,0.6395089285714286,0.5681818181818182,[0.0],69.68,1024.0,True,0.5,11198.0,16.0,132.0,False,1.0,0.0,0.4878048780487805,"{'v4': {'micro': 0.6097560975609756, 'macro': 0.6395089285714286}, 'v3_legacy': {'micro': 0.6097560975609756, 'macro': 0.6395089285714286}, 'equal': {'micro': 0.6097560975609756, 'macro': 0.6395089285714286}, 'mrr_only': {'micro': 0.6097560975609756, 'macro': 0.6395089285714286}}",208.0,[0.0],COMPLETE
209,0.6409970238095238,2026-07-22 20:19:10.800266,2026-07-22 20:21:01.686960,0 days 00:01:50.886694,800,arctic-l,0.0,0.47065659987463226,1,True,0.7286458333333333,0.7073170731707317,0.6765625,0.6890243902439024,0.6409970238095238,0.6097560975609756,0.6409970238095238,0.6097560975609756,0.6409970238095238,0.6097560975609756,0.6409970238095238,0.6097560975609756,0.32,0.6409970238095238,0.5,[0.18],110.73,1024.0,False,0.5,11198.0,16.0,132.0,False,1.0,0.0,0.4878048780487805,"{'v4': {'micro': 0.6097560975609756, 'macro': 0.6409970238095238}, 'v3_legacy': {'micro': 0.6097560975609756, 'macro': 0.6409970238095238}, 'equal': {'micro': 0.6097560975609756, 'macro': 0.6409970238095238}, 'mrr_only': {'micro': 0.6097560975609756, 'macro': 0.6409970238095238}}",209.0,[0.18],COMPLETE
210,0.6395089285714286,2026-07-22 20:21:01.700804,2026-07-22 20:22:16.122667,0 days 00:01:14.421863,800,arctic-l,0.0,0.5206518602040993,1,True,0.7286458333333333,0.7073170731707317,0.6765625,0.6890243902439024,0.6395089285714286,0.6097560975609756,0.6395089285714286,0.6097560975609756,0.6395089285714286,0.6097560975609756,0.6395089285714286,0.6097560975609756,0.46,0.6395089285714286,0.553030303030303,[0.03999999999999998],74.26,1024.0,False,0.5,11198.0,16.0,132.0,False,1.0,0.0,0.4878048780487805,"{'v4': {'micro': 0.6097560975609756, 'macro': 0.6395089285714286}, 'v3_legacy': {'micro': 0.6097560975609756, 'macro': 0.6395089285714286}, 'equal': {'micro': 0.6097560975609756, 'macro': 0.6395089285714286}, 'mrr_only': {'micro': 0.6097560975609756, 'macro': 0.6395089285714286}}",210.0,[0.03999999999999998],COMPLETE
211,0.6024553571428571,2026-07-22 20:22:16.136613,2026-07-22 20:23:19.468292,0 days 00:01:03.331679,800,arctic-l,0.0,0.5304175996330458,1,True,0.7161458333333334,0.6951219512195121,0.6640625,0.676829268292683,0.6024553571428571,0.573170731707317,0.6024553571428571,0.573170731707317,0.6024553571428571,0.573170731707317,0.6024553571428571,0.573170731707317,0.52,0.6024553571428571,0.553030303030303,[-0.020000000000000018],63.17,1024.0,True,0.5,11198.0,16.0,132.0,False,1.0,0.0,0.49461706806520117,"{'v4': {'micro': 0.573170731707317, 'macro': 0.6024553571428571}, 'v3_legacy': {'micro': 0.573170731707317, 'macro': 0.6024553571428571}, 'equal': {'micro': 0.573170731707317, 'macro': 0.6024553571428571}, 'mrr_only': {'micro': 0.573170731707317, 'macro': 0.6024553571428571}}",211.0,[-0.020000000000000018],COMPLETE
212,0.6395089285714286,2026-07-22 20:23:19.482057,2026-07-22 20:24:42.019640,0 days 00:01:22.537583,800,arctic-l,0.0,0.5095836222780654,1,True,0.7286458333333333,0.7073170731707317,0.6765625,0.6890243902439024,0.6395089285714286,0.6097560975609756,0.6395089285714286,0.6097560975609756,0.6395089285714286,0.6097560975609756,0.6395089285714286,0.6097560975609756,0.36,0.6395089285714286,0.5151515151515151,[0.14],82.38,1024.0,False,0.5,11198.0,16.0,132.0,False,1.0,0.0,0.4878048780487805,"{'v4': {'micro': 0.6097560975609756, 'macro': 0.6395089285714286}, 'v3_legacy': {'micro': 0.6097560975609756, 'macro': 0.6395089285714286}, 'equal': {'micro': 0.6097560975609756, 'macro': 0.6395089285714286}, 'mrr_only': {'micro': 0.6097560975609756, 'macro': 0.6395089285714286}}",212.0,[0.14],COMPLETE
213,0.6395089285714286,2026-07-22 20:24:42.033310,2026-07-22 20:25:52.664051,0 days 00:01:10.630741,800,arctic-l,0.0,0.524577299883803,1,True,0.7286458333333333,0.7073170731707317,0.6765625,0.6890243902439024,0.6395089285714286,0.6097560975609756,0.6395089285714286,0.6097560975609756,0.6395089285714286,0.6097560975609756,0.6395089285714286,0.6097560975609756,0.48,0.6395089285714286,0.5606060606060606,[0.020000000000000018],70.47,1024.0,False,0.5,11198.0,16.0,132.0,False,1.0,0.0,0.4878048780487805,"{'v4': {'micro': 0.6097560975609756, 'macro': 0.6395089285714286}, 'v3_legacy': {'micro': 0.6097560975609756, 'macro': 0.6395089285714286}, 'equal': {'micro': 0.6097560975609756, 'macro': 0.6395089285714286}, 'mrr_only': {'micro': 0.6097560975609756, 'macro': 0.6395089285714286}}",213.0,[0.020000000000000018],COMPLETE
214,0.6305803571428571,2026-07-22 20:25:52.678048,2026-07-22 20:27:31.409693,0 days 00:01:38.731645,800,arctic-l,0.0,0.49110530885563136,1,True,0.7286458333333333,0.7073170731707317,0.6765625,0.6890243902439024,0.6305803571428571,0.5975609756097561,0.6305803571428571,0.5975609756097561,0.6305803571428571,0.5975609756097561,0.6305803571428571,0.5975609756097561,0.36,0.6305803571428571,0.5075757575757576,[0.14],98.57,1024.0,False,0.5,11198.0,16.0,132.0,False,1.0,0.0,0.490389494216661,"{'v4': {'micro': 0.5975609756097561, 'macro': 0.6305803571428571}, 'v3_legacy': {'micro': 0.5975609756097561, 'macro': 0.6305803571428571}, 'equal': {'micro': 0.5975609756097561, 'macro': 0.6305803571428571}, 'mrr_only': {'micro': 0.5975609756097561, 'macro': 0.6305803571428571}}",214.0,[0.14],COMPLETE
