number,value,datetime_start,datetime_complete,duration,params_chunk_size,params_embedding_model,params_overlap_ratio,params_similarity_threshold,params_top_k,params_use_reranker,user_attrs_avg_doc_mrr_in_scope_macro,user_attrs_avg_doc_mrr_in_scope_micro,user_attrs_avg_doc_recall_in_scope_macro,user_attrs_avg_doc_recall_in_scope_micro,user_attrs_avg_mrr_in_scope_macro,user_attrs_avg_mrr_in_scope_micro,user_attrs_avg_ndcg_in_scope_macro,user_attrs_avg_ndcg_in_scope_micro,user_attrs_avg_precision_in_scope_macro,user_attrs_avg_precision_in_scope_micro,user_attrs_avg_recall_in_scope_macro,user_attrs_avg_recall_in_scope_micro,user_attrs_avg_score_hors_perimetre,user_attrs_avg_score_in_scope_macro,user_attrs_avg_score_v3_replica,user_attrs_constraint,user_attrs_duration_seconds,user_attrs_embedding_dim,user_attrs_hors_perimetre_constraint_satisfied,user_attrs_hors_perimetre_min_required,user_attrs_num_chunks,user_attrs_num_docs_in_scope_evaluated,user_attrs_num_questions_evaluated,user_attrs_pruned_early,user_attrs_score_max,user_attrs_score_min,user_attrs_score_std,user_attrs_score_variants,user_attrs_trial_number,system_attrs_constraints,state
63,0.6015755208333333,2026-07-22 18:27:07.882088,2026-07-22 18:27:47.194394,0 days 00:00:39.312306,800,arctic-l,0.0,0.5553508377544739,2,True,0.7366443452380952,0.7134146341463414,0.7431547619047619,0.7560975609756098,0.6521949404761904,0.6280487804878049,0.6865728999721024,0.661001058493036,0.45546875,0.42073170731707316,0.7081845238095238,0.6951219512195121,0.62,0.6015755208333333,0.5988636363636364,[-0.12],39.12,1024.0,True,0.5,11198.0,16.0,132.0,False,1.0,0.0,0.39823247289588104,"{'v4': {'micro': 0.5759146341463415, 'macro': 0.6015755208333333}, 'v3_legacy': {'micro': 0.5859756097560975, 'macro': 0.6099739583333333}, 'equal': {'micro': 0.5813008130081301, 'macro': 0.605282738095238}, 'mrr_only': {'micro': 0.6280487804878049, 'macro': 0.6521949404761904}}",63.0,[-0.12],COMPLETE
64,0.5801692708333334,2026-07-22 18:27:47.209272,2026-07-22 18:28:41.342379,0 days 00:00:54.133107,800,arctic-l,0.0,0.5420985321280993,2,True,0.7356026785714286,0.7134146341463414,0.7431547619047619,0.7560975609756098,0.6459449404761904,0.6219512195121951,0.6616257031732173,0.6562833413316391,0.40078125,0.39634146341463417,0.6977678571428572,0.6829268292682927,0.58,0.5801692708333334,0.5753787878787879,[-0.07999999999999996],53.94,1024.0,True,0.5,11198.0,16.0,132.0,False,1.0,0.0,0.3983042393735158,"{'v4': {'micro': 0.5634146341463415, 'macro': 0.5801692708333334}, 'v3_legacy': {'micro': 0.5725609756097562, 'macro': 0.5879427083333333}, 'equal': {'micro': 0.5670731707317073, 'macro': 0.5814980158730159}, 'mrr_only': {'micro': 0.6219512195121951, 'macro': 0.6459449404761904}}",64.0,[-0.07999999999999996],COMPLETE
65,0.41718750000000004,2026-07-22 18:28:41.358176,2026-07-22 18:29:04.486658,0 days 00:00:23.128482,800,e5-small,0.0,0.4665168742989287,2,True,0.4833333333333333,0.53125,0.475,0.53125,0.38333333333333336,0.46875,0.45079063380952766,0.5163662191964322,0.25,0.28125,0.4,0.5,0.0,0.3458333333333333,0.28125,[0.5],22.91,384.0,False,0.5,11198.0,10.0,24.0,True,1.0,0.0,0.4243302397234376,"{'v4': {'micro': 0.41718750000000004, 'macro': 0.3458333333333333}, 'v3_legacy': {'micro': 0.421875, 'macro': 0.34833333333333333}, 'equal': {'micro': 0.41666666666666663, 'macro': 0.34444444444444444}, 'mrr_only': {'micro': 0.46875, 'macro': 0.38333333333333336}}",65.0,[0.5],PRUNED
66,0.6138560267857144,2026-07-22 18:29:04.497228,2026-07-22 18:30:36.364855,0 days 00:01:31.867627,800,arctic-l,0.0,0.505995122935898,2,True,0.7690104166666667,0.7560975609756098,0.7572916666666667,0.7804878048780488,0.6965401785714286,0.676829268292683,0.7068273729267264,0.704846968638883,0.3976190476190476,0.3902439024390244,0.7431547619047619,0.7317073170731707,0.36,0.6138560267857144,0.5136363636363637,[0.14],91.66,1024.0,False,0.5,11198.0,16.0,132.0,False,1.0,0.0,0.374541286962466,"{'v4': {'micro': 0.5990853658536586, 'macro': 0.6138560267857144}, 'v3_legacy': {'micro': 0.6073170731707317, 'macro': 0.6208482142857142}, 'equal': {'micro': 0.5995934959349594, 'macro': 0.612437996031746}, 'mrr_only': {'micro': 0.676829268292683, 'macro': 0.6965401785714286}}",66.0,[0.14],COMPLETE
67,0.5976171875,2026-07-22 18:30:36.378982,2026-07-22 18:31:21.527358,0 days 00:00:45.148376,800,arctic-l,0.0,0.549926297108034,2,True,0.740811011904762,0.7195121951219512,0.7535714285714286,0.7682926829268293,0.6563616071428572,0.6341463414634146,0.6747700730392894,0.6716718719065526,0.42942708333333335,0.42073170731707316,0.7186011904761904,0.7073170731707317,0.58,0.5976171875,0.5875,[-0.07999999999999996],44.98,1024.0,True,0.5,11198.0,16.0,132.0,False,1.0,0.0,0.3914591406194764,"{'v4': {'micro': 0.5810975609756098, 'macro': 0.5976171875}, 'v3_legacy': {'micro': 0.5920731707317073, 'macro': 0.606953125}, 'equal': {'micro': 0.5873983739837398, 'macro': 0.6014632936507937}, 'mrr_only': {'micro': 0.6341463414634146, 'macro': 0.6563616071428572}}",67.0,[-0.07999999999999996],COMPLETE
68,0.5887630208333334,2026-07-22 18:31:21.541750,2026-07-22 18:32:05.585985,0 days 00:00:44.044235,800,arctic-l,0.0,0.5502713685960986,2,True,0.7303943452380952,0.7073170731707317,0.7431547619047619,0.7560975609756098,0.6459449404761904,0.6219512195121951,0.6643534063726227,0.6594767499553331,0.42421875,0.4146341463414634,0.7081845238095238,0.6951219512195121,0.58,0.5887630208333334,0.581060606060606,[-0.07999999999999996],43.87,1024.0,True,0.5,11198.0,16.0,132.0,False,1.0,0.0,0.39543517395336003,"{'v4': {'micro': 0.5707317073170732, 'macro': 0.5887630208333334}, 'v3_legacy': {'micro': 0.5817073170731708, 'macro': 0.5980989583333334}, 'equal': {'micro': 0.5772357723577235, 'macro': 0.5927827380952381}, 'mrr_only': {'micro': 0.6219512195121951, 'macro': 0.6459449404761904}}",68.0,[-0.07999999999999996],COMPLETE
69,,2026-07-22 18:32:05.600365,2026-07-22 18:32:13.410818,0 days 00:00:07.810453,800,bge-m3,0.15,0.16119567086058328,2,True,,,,,,,,,,,,,,,,[0.5],,,,,,,,,,,,,,[0.5],PRUNED
70,,2026-07-22 18:32:13.419254,2026-07-22 18:32:23.460465,0 days 00:00:10.041211,1024,e5-large,0.0,0.43138424890971155,2,True,,,,,,,,,,,,,,,,[0.5],,,,,,,,,,,,,,[0.5],PRUNED
71,0.5887630208333334,2026-07-22 18:32:23.468909,2026-07-22 18:33:07.690896,0 days 00:00:44.221987,800,arctic-l,0.0,0.5502782013241939,2,True,0.7303943452380952,0.7073170731707317,0.7431547619047619,0.7560975609756098,0.6459449404761904,0.6219512195121951,0.6643534063726227,0.6594767499553331,0.42421875,0.4146341463414634,0.7081845238095238,0.6951219512195121,0.58,0.5887630208333334,0.581060606060606,[-0.07999999999999996],44.05,1024.0,True,0.5,11198.0,16.0,132.0,False,1.0,0.0,0.39543517395336003,"{'v4': {'micro': 0.5707317073170732, 'macro': 0.5887630208333334}, 'v3_legacy': {'micro': 0.5817073170731708, 'macro': 0.5980989583333334}, 'equal': {'micro': 0.5772357723577235, 'macro': 0.5927827380952381}, 'mrr_only': {'micro': 0.6219512195121951, 'macro': 0.6459449404761904}}",71.0,[-0.07999999999999996],COMPLETE
72,0.5981380208333333,2026-07-22 18:33:07.704920,2026-07-22 18:33:50.368710,0 days 00:00:42.663790,800,arctic-l,0.0,0.5517838940513456,2,True,0.7303943452380952,0.7073170731707317,0.7431547619047619,0.7560975609756098,0.6459449404761904,0.6219512195121951,0.6885317068247816,0.66419446711673,0.45546875,0.42073170731707316,0.7081845238095238,0.6951219512195121,0.6,0.5981380208333333,0.5897727272727272,[-0.09999999999999998],42.49,1024.0,True,0.5,11198.0,16.0,132.0,False,1.0,0.0,0.3970664101719674,"{'v4': {'micro': 0.5725609756097562, 'macro': 0.5981380208333333}, 'v3_legacy': {'micro': 0.5835365853658536, 'macro': 0.6074739583333333}, 'equal': {'micro': 0.5792682926829268, 'macro': 0.6031994047619047}, 'mrr_only': {'micro': 0.6219512195121951, 'macro': 0.6459449404761904}}",72.0,[-0.09999999999999998],COMPLETE
73,0.5828776041666667,2026-07-22 18:33:50.382693,2026-07-22 18:34:26.277131,0 days 00:00:35.894438,800,arctic-l,0.0,0.5583974917003358,2,True,0.7158110119047619,0.6890243902439024,0.7223214285714286,0.7317073170731707,0.6261532738095238,0.6036585365853658,0.6605312333054357,0.636610814590597,0.45390625,0.42073170731707316,0.6821428571428572,0.6707317073170732,0.64,0.5828776041666667,0.5958333333333333,[-0.14],35.72,1024.0,True,0.5,11198.0,16.0,132.0,False,1.0,0.0,0.4087900787992386,"{'v4': {'micro': 0.5588414634146341, 'macro': 0.5828776041666667}, 'v3_legacy': {'micro': 0.5689024390243902, 'macro': 0.5912760416666667}, 'equal': {'micro': 0.565040650406504, 'macro': 0.5874007936507936}, 'mrr_only': {'micro': 0.6036585365853658, 'macro': 0.6261532738095238}}",73.0,[-0.14],COMPLETE
74,0.6138560267857144,2026-07-22 18:34:26.291648,2026-07-22 18:35:53.330825,0 days 00:01:27.039177,800,arctic-l,0.0,0.5123190841925527,2,True,0.7690104166666667,0.7560975609756098,0.7572916666666667,0.7804878048780488,0.6965401785714286,0.676829268292683,0.7068273729267264,0.704846968638883,0.3976190476190476,0.3902439024390244,0.7431547619047619,0.7317073170731707,0.4,0.6138560267857144,0.5287878787878788,[0.09999999999999998],86.87,1024.0,False,0.5,11198.0,16.0,132.0,False,1.0,0.0,0.374541286962466,"{'v4': {'micro': 0.5990853658536586, 'macro': 0.6138560267857144}, 'v3_legacy': {'micro': 0.6073170731707317, 'macro': 0.6208482142857142}, 'equal': {'micro': 0.5995934959349594, 'macro': 0.612437996031746}, 'mrr_only': {'micro': 0.676829268292683, 'macro': 0.6965401785714286}}",74.0,[0.09999999999999998],COMPLETE
75,0.276171875,2026-07-22 18:35:53.344860,2026-07-22 18:35:57.345182,0 days 00:00:04.000322,800,arctic-l,0.0,0.6437410916839563,2,True,0.3111111111111111,0.3359375,0.31666666666666665,0.34375,0.26666666666666666,0.2890625,0.28915243349206476,0.3108248321986621,0.22777777777777777,0.2421875,0.2722222222222222,0.296875,0.9767441860465116,0.2558333333333333,0.5584112149532711,[-0.4767441860465116],3.83,1024.0,True,0.5,11198.0,15.0,107.0,True,1.0,0.0,0.42910311824080744,"{'v4': {'micro': 0.276171875, 'macro': 0.2558333333333333}, 'v3_legacy': {'micro': 0.27734375, 'macro': 0.25666666666666665}, 'equal': {'micro': 0.2760416666666667, 'macro': 0.25555555555555554}, 'mrr_only': {'micro': 0.2890625, 'macro': 0.26666666666666666}}",75.0,[-0.4767441860465116],PRUNED
76,,2026-07-22 18:35:57.355618,2026-07-22 18:37:35.692118,0 days 00:01:38.336500,512,arctic-l,0.0,0.6201081968645508,2,True,,,,,,,,,,,,,,,,[0.5],,,,,,,,,,,,,,[0.5],PRUNED
77,0.551045386904762,2026-07-22 18:37:35.701106,2026-07-22 18:43:27.561603,0 days 00:05:51.860497,800,e5-base,0.3,0.47615243002975827,2,True,0.6914434523809524,0.6646341463414634,0.6654017857142858,0.6707317073170732,0.6206101190476191,0.5914634146341463,0.6501393444914025,0.6334174059669029,0.3673735119047619,0.3475609756097561,0.6633184523809523,0.6341463414634146,0.0,0.551045386904762,0.3299242424242424,[0.5],351.69,768.0,False,0.5,11728.0,16.0,132.0,False,1.0,0.0,0.40784034684271986,"{'v4': {'micro': 0.5246951219512196, 'macro': 0.551045386904762}, 'v3_legacy': {'micro': 0.5310975609756097, 'macro': 0.557451636904762}, 'equal': {'micro': 0.524390243902439, 'macro': 0.5504340277777777}, 'mrr_only': {'micro': 0.5914634146341463, 'macro': 0.6206101190476191}}",77.0,[0.5],COMPLETE
78,0.5981380208333333,2026-07-22 18:43:27.576035,2026-07-22 18:44:12.367579,0 days 00:00:44.791544,800,arctic-l,0.0,0.5530868962053518,2,True,0.7303943452380952,0.7073170731707317,0.7431547619047619,0.7560975609756098,0.6459449404761904,0.6219512195121951,0.6819595218917456,0.6565002018292733,0.45546875,0.42073170731707316,0.7081845238095238,0.6951219512195121,0.6,0.5981380208333333,0.5897727272727272,[-0.09999999999999998],44.61,1024.0,True,0.5,11198.0,16.0,132.0,False,1.0,0.0,0.3970664101719674,"{'v4': {'micro': 0.5725609756097562, 'macro': 0.5981380208333333}, 'v3_legacy': {'micro': 0.5835365853658536, 'macro': 0.6074739583333333}, 'equal': {'micro': 0.5792682926829268, 'macro': 0.6031994047619047}, 'mrr_only': {'micro': 0.6219512195121951, 'macro': 0.6459449404761904}}",78.0,[-0.09999999999999998],COMPLETE
79,,2026-07-22 18:44:12.381572,2026-07-22 18:44:20.450107,0 days 00:00:08.068535,800,arctic-l,0.25,0.49486591457565493,2,True,,,,,,,,,,,,,,,,[0.5],,,,,,,,,,,,,,[0.5],PRUNED
80,0.37833333333333335,2026-07-22 18:44:20.458626,2026-07-22 18:44:37.831459,0 days 00:00:17.372833,800,miniLM,0.0,0.6144158822594524,2,True,0.525,0.5666666666666667,0.525,0.5666666666666667,0.375,0.43333333333333335,0.3815464876785729,0.4420619835714305,0.2,0.23333333333333334,0.4,0.4666666666666667,0.16666666666666666,0.32625000000000004,0.32142857142857145,[0.33333333333333337],17.2,384.0,False,0.5,11198.0,10.0,21.0,True,0.8500000000000001,0.0,0.409762804016611,"{'v4': {'micro': 0.37833333333333335, 'macro': 0.32625000000000004}, 'v3_legacy': {'micro': 0.38333333333333336, 'macro': 0.32999999999999996}, 'equal': {'micro': 0.3777777777777777, 'macro': 0.325}, 'mrr_only': {'micro': 0.43333333333333335, 'macro': 0.375}}",80.0,[0.33333333333333337],PRUNED
81,0.5965755208333334,2026-07-22 18:44:37.840780,2026-07-22 18:45:20.106871,0 days 00:00:42.266091,800,arctic-l,0.0,0.5525380380107787,2,True,0.7303943452380952,0.7073170731707317,0.7431547619047619,0.7560975609756098,0.6459449404761904,0.6219512195121951,0.6819595218917456,0.6565002018292733,0.45026041666666666,0.4146341463414634,0.7081845238095238,0.6951219512195121,0.6,0.5965755208333334,0.5886363636363636,[-0.09999999999999998],42.1,1024.0,True,0.5,11198.0,16.0,132.0,False,1.0,0.0,0.39543517395336003,"{'v4': {'micro': 0.5707317073170732, 'macro': 0.5965755208333334}, 'v3_legacy': {'micro': 0.5817073170731708, 'macro': 0.6059114583333334}, 'equal': {'micro': 0.5772357723577235, 'macro': 0.6014632936507937}, 'mrr_only': {'micro': 0.6219512195121951, 'macro': 0.6459449404761904}}",81.0,[-0.09999999999999998],COMPLETE
82,0.569164806547619,2026-07-22 18:45:20.120865,2026-07-22 18:45:46.378738,0 days 00:00:26.257873,800,arctic-l,0.0,0.5697745810522937,2,True,0.6954985119047619,0.6707317073170732,0.6941964285714286,0.7073170731707317,0.6084449404761905,0.5853658536585366,0.6414590483723996,0.6167214273519206,0.45212053571428573,0.4146341463414634,0.6592261904761905,0.6463414634146342,0.74,0.569164806547619,0.6234848484848484,[-0.24],26.09,1024.0,True,0.5,11198.0,16.0,132.0,False,1.0,0.0,0.41807574549458226,"{'v4': {'micro': 0.5432926829268293, 'macro': 0.569164806547619}, 'v3_legacy': {'micro': 0.5524390243902438, 'macro': 0.5767819940476191}, 'equal': {'micro': 0.5487804878048781, 'macro': 0.5732638888888888}, 'mrr_only': {'micro': 0.5853658536585366, 'macro': 0.6084449404761905}}",82.0,[-0.24],COMPLETE
83,0.610991443452381,2026-07-22 18:45:46.392263,2026-07-22 18:47:12.107546,0 days 00:01:25.715283,800,arctic-l,0.0,0.5133236105357247,2,True,0.77421875,0.7621951219512195,0.7677083333333333,0.7926829268292683,0.6913318452380952,0.6707317073170732,0.7029828911930956,0.7003461119751203,0.3976190476190476,0.3902439024390244,0.7431547619047619,0.7317073170731707,0.4,0.610991443452381,0.5272727272727272,[0.09999999999999998],85.56,1024.0,False,0.5,11198.0,16.0,132.0,False,1.0,0.0,0.3735093314790986,"{'v4': {'micro': 0.5957317073170731, 'macro': 0.610991443452381}, 'v3_legacy': {'micro': 0.6048780487804878, 'macro': 0.6187648809523809}, 'equal': {'micro': 0.597560975609756, 'macro': 0.6107018849206349}, 'mrr_only': {'micro': 0.6707317073170732, 'macro': 0.6913318452380952}}",83.0,[0.09999999999999998],COMPLETE
84,0.5952734375000001,2026-07-22 18:47:12.121172,2026-07-22 18:47:57.875382,0 days 00:00:45.754210,800,arctic-l,0.0,0.5490458896535075,2,True,0.740811011904762,0.7195121951219512,0.7535714285714286,0.7682926829268293,0.6563616071428572,0.6341463414634146,0.6747700730392894,0.6716718719065526,0.42161458333333335,0.4146341463414634,0.7186011904761904,0.7073170731707317,0.58,0.5952734375000001,0.5863636363636364,[-0.07999999999999996],45.6,1024.0,True,0.5,11198.0,16.0,132.0,False,1.0,0.0,0.3898444983542606,"{'v4': {'micro': 0.5792682926829269, 'macro': 0.5952734375000001}, 'v3_legacy': {'micro': 0.5902439024390244, 'macro': 0.604609375}, 'equal': {'micro': 0.5853658536585366, 'macro': 0.5988591269841269}, 'mrr_only': {'micro': 0.6341463414634146, 'macro': 0.6563616071428572}}",84.0,[-0.07999999999999996],COMPLETE
85,0.38833333333333336,2026-07-22 18:47:57.889332,2026-07-22 18:48:17.827069,0 days 00:00:19.937737,800,e5-small,0.0,0.44922492012482285,2,True,0.475,0.5,0.475,0.5,0.375,0.43333333333333335,0.44463946303571866,0.48412396714286104,0.25,0.26666666666666666,0.4,0.4666666666666667,0.0,0.34125000000000005,0.28095238095238095,[0.5],19.78,384.0,False,0.5,11198.0,10.0,21.0,True,1.0,0.0,0.42277522265252127,"{'v4': {'micro': 0.38833333333333336, 'macro': 0.34125000000000005}, 'v3_legacy': {'micro': 0.39333333333333337, 'macro': 0.34500000000000003}, 'equal': {'micro': 0.3888888888888889, 'macro': 0.3416666666666667}, 'mrr_only': {'micro': 0.43333333333333335, 'macro': 0.375}}",85.0,[0.5],PRUNED
86,,2026-07-22 18:48:17.835919,2026-07-22 18:49:10.183138,0 days 00:00:52.347219,800,arctic-l,0.4,0.6515253028994274,2,True,,,,,,,,,,,,,,,,[0.5],,,,,,,,,,,,,,[0.5],PRUNED
87,,2026-07-22 18:49:10.192842,2026-07-22 18:49:10.496085,0 days 00:00:00.303243,1024,arctic-l,0.0,0.6119528252418913,2,True,,,,,,,,,,,,,,,,[0.5],,,,,,,,,,,,,,[0.5],PRUNED
88,0.1716666666666667,2026-07-22 18:49:10.504365,2026-07-22 18:49:11.167048,0 days 00:00:00.662683,800,arctic-l,0.0,0.6894381544538675,4,True,0.125,0.16666666666666666,0.15,0.2,0.125,0.16666666666666666,0.13154648767857288,0.17539531690476384,0.125,0.16666666666666666,0.15,0.2,1.0,0.12875,0.41190476190476194,[-0.5],0.5,1024.0,True,0.5,11198.0,10.0,21.0,True,1.0,0.0,0.3548317285074089,"{'v4': {'micro': 0.1716666666666667, 'macro': 0.12875}, 'v3_legacy': {'micro': 0.17666666666666667, 'macro': 0.1325}, 'equal': {'micro': 0.17777777777777776, 'macro': 0.13333333333333333}, 'mrr_only': {'micro': 0.16666666666666666, 'macro': 0.125}}",88.0,[-0.5],PRUNED
89,0.5726023065476191,2026-07-22 18:49:11.176325,2026-07-22 18:49:34.565980,0 days 00:00:23.389655,800,arctic-l,0.0,0.5733760643536836,2,True,0.6798735119047619,0.6585365853658537,0.6785714285714286,0.6951219512195121,0.6084449404761905,0.5853658536585366,0.6414590483723996,0.6167214273519206,0.463578869047619,0.4268292682926829,0.6592261904761905,0.6463414634146342,0.76,0.5726023065476191,0.6333333333333333,[-0.26],23.23,1024.0,True,0.5,11198.0,16.0,132.0,False,1.0,0.0,0.4213869058830997,"{'v4': {'micro': 0.5469512195121952, 'macro': 0.5726023065476191}, 'v3_legacy': {'micro': 0.5560975609756098, 'macro': 0.5802194940476191}, 'equal': {'micro': 0.5528455284552845, 'macro': 0.5770833333333333}, 'mrr_only': {'micro': 0.5853658536585366, 'macro': 0.6084449404761905}}",89.0,[-0.26],COMPLETE
90,,2026-07-22 18:49:34.579793,2026-07-22 18:51:14.838170,0 days 00:01:40.258377,512,e5-large,0.15,0.49010117437821993,2,True,,,,,,,,,,,,,,,,[0.5],,,,,,,,,,,,,,[0.5],PRUNED
91,0.5801692708333334,2026-07-22 18:51:14.846641,2026-07-22 18:52:05.562306,0 days 00:00:50.715665,800,arctic-l,0.0,0.5451622293255234,2,True,0.7356026785714286,0.7134146341463414,0.7431547619047619,0.7560975609756098,0.6459449404761904,0.6219512195121951,0.6616257031732173,0.6562833413316391,0.40078125,0.39634146341463417,0.6977678571428572,0.6829268292682927,0.58,0.5801692708333334,0.5753787878787879,[-0.07999999999999996],50.55,1024.0,True,0.5,11198.0,16.0,132.0,False,1.0,0.0,0.3983042393735158,"{'v4': {'micro': 0.5634146341463415, 'macro': 0.5801692708333334}, 'v3_legacy': {'micro': 0.5725609756097562, 'macro': 0.5879427083333333}, 'equal': {'micro': 0.5670731707317073, 'macro': 0.5814980158730159}, 'mrr_only': {'micro': 0.6219512195121951, 'macro': 0.6459449404761904}}",91.0,[-0.07999999999999996],COMPLETE
92,0.5887630208333334,2026-07-22 18:52:05.576279,2026-07-22 18:52:48.284108,0 days 00:00:42.707829,800,arctic-l,0.0,0.551422755450514,2,True,0.7303943452380952,0.7073170731707317,0.7431547619047619,0.7560975609756098,0.6459449404761904,0.6219512195121951,0.6643534063726227,0.6594767499553331,0.42421875,0.4146341463414634,0.7081845238095238,0.6951219512195121,0.6,0.5887630208333334,0.5886363636363636,[-0.09999999999999998],42.55,1024.0,True,0.5,11198.0,16.0,132.0,False,1.0,0.0,0.39543517395336003,"{'v4': {'micro': 0.5707317073170732, 'macro': 0.5887630208333334}, 'v3_legacy': {'micro': 0.5817073170731708, 'macro': 0.5980989583333334}, 'equal': {'micro': 0.5772357723577235, 'macro': 0.5927827380952381}, 'mrr_only': {'micro': 0.6219512195121951, 'macro': 0.6459449404761904}}",92.0,[-0.09999999999999998],COMPLETE
93,0.610991443452381,2026-07-22 18:52:48.297469,2026-07-22 18:54:08.650312,0 days 00:01:20.352843,800,arctic-l,0.0,0.5186236313717796,2,True,0.7768229166666667,0.7621951219512195,0.7833333333333333,0.8048780487804879,0.6913318452380952,0.6707317073170732,0.7029828911930956,0.7003461119751203,0.3976190476190476,0.3902439024390244,0.7431547619047619,0.7317073170731707,0.46,0.610991443452381,0.5499999999999999,[0.03999999999999998],80.18,1024.0,False,0.5,11198.0,16.0,132.0,False,1.0,0.0,0.3735093314790986,"{'v4': {'micro': 0.5957317073170731, 'macro': 0.610991443452381}, 'v3_legacy': {'micro': 0.6048780487804878, 'macro': 0.6187648809523809}, 'equal': {'micro': 0.597560975609756, 'macro': 0.6107018849206349}, 'mrr_only': {'micro': 0.6707317073170732, 'macro': 0.6913318452380952}}",93.0,[0.03999999999999998],COMPLETE
