number,value,datetime_start,datetime_complete,duration,params_chunk_size,params_embedding_model,params_overlap_ratio,params_similarity_threshold,params_top_k,params_use_reranker,user_attrs_avg_doc_mrr_in_scope_macro,user_attrs_avg_doc_mrr_in_scope_micro,user_attrs_avg_doc_recall_in_scope_macro,user_attrs_avg_doc_recall_in_scope_micro,user_attrs_avg_mrr_in_scope_macro,user_attrs_avg_mrr_in_scope_micro,user_attrs_avg_ndcg_in_scope_macro,user_attrs_avg_ndcg_in_scope_micro,user_attrs_avg_precision_in_scope_macro,user_attrs_avg_precision_in_scope_micro,user_attrs_avg_recall_in_scope_macro,user_attrs_avg_recall_in_scope_micro,user_attrs_avg_score_hors_perimetre,user_attrs_avg_score_in_scope_macro,user_attrs_avg_score_v3_replica,user_attrs_constraint,user_attrs_duration_seconds,user_attrs_embedding_dim,user_attrs_hors_perimetre_constraint_satisfied,user_attrs_hors_perimetre_min_required,user_attrs_num_chunks,user_attrs_num_docs_in_scope_evaluated,user_attrs_num_questions_evaluated,user_attrs_pruned_early,user_attrs_score_max,user_attrs_score_min,user_attrs_score_std,user_attrs_score_variants,user_attrs_trial_number,system_attrs_constraints,state
215,0.5301339285714286,2026-07-22 20:27:31.423551,2026-07-22 20:29:40.621877,0 days 00:02:09.198326,800,e5-small,0.0,0.5311117997281829,1,True,0.6223958333333334,0.6097560975609756,0.5807291666666666,0.5975609756097561,0.5301339285714286,0.5121951219512195,0.5301339285714286,0.5121951219512195,0.5301339285714286,0.5121951219512195,0.5301339285714286,0.5121951219512195,0.0,0.5301339285714286,0.3181818181818182,[0.5],129.04,384.0,False,0.5,11198.0,16.0,132.0,False,1.0,0.0,0.49985125687607795,"{'v4': {'micro': 0.5121951219512195, 'macro': 0.5301339285714286}, 'v3_legacy': {'micro': 0.5121951219512195, 'macro': 0.5301339285714286}, 'equal': {'micro': 0.5121951219512195, 'macro': 0.5301339285714286}, 'mrr_only': {'micro': 0.5121951219512195, 'macro': 0.5301339285714286}}",215.0,[0.5],COMPLETE
216,0.6024553571428571,2026-07-22 20:29:40.635786,2026-07-22 20:30:46.326312,0 days 00:01:05.690526,800,arctic-l,0.0,0.531415732371986,1,True,0.7161458333333334,0.6951219512195121,0.6640625,0.676829268292683,0.6024553571428571,0.573170731707317,0.6024553571428571,0.573170731707317,0.6024553571428571,0.573170731707317,0.6024553571428571,0.573170731707317,0.52,0.6024553571428571,0.553030303030303,[-0.020000000000000018],65.53,1024.0,True,0.5,11198.0,16.0,132.0,False,1.0,0.0,0.49461706806520117,"{'v4': {'micro': 0.573170731707317, 'macro': 0.6024553571428571}, 'v3_legacy': {'micro': 0.573170731707317, 'macro': 0.6024553571428571}, 'equal': {'micro': 0.573170731707317, 'macro': 0.6024553571428571}, 'mrr_only': {'micro': 0.573170731707317, 'macro': 0.6024553571428571}}",216.0,[-0.020000000000000018],COMPLETE
217,0.6305803571428571,2026-07-22 20:30:46.345005,2026-07-22 20:32:14.476551,0 days 00:01:28.131546,800,arctic-l,0.0,0.5022377380060228,1,True,0.7286458333333333,0.7073170731707317,0.6765625,0.6890243902439024,0.6305803571428571,0.5975609756097561,0.6305803571428571,0.5975609756097561,0.6305803571428571,0.5975609756097561,0.6305803571428571,0.5975609756097561,0.36,0.6305803571428571,0.5075757575757576,[0.14],87.97,1024.0,False,0.5,11198.0,16.0,132.0,False,1.0,0.0,0.490389494216661,"{'v4': {'micro': 0.5975609756097561, 'macro': 0.6305803571428571}, 'v3_legacy': {'micro': 0.5975609756097561, 'macro': 0.6305803571428571}, 'equal': {'micro': 0.5975609756097561, 'macro': 0.6305803571428571}, 'mrr_only': {'micro': 0.5975609756097561, 'macro': 0.6305803571428571}}",217.0,[0.14],COMPLETE
218,0.6024553571428571,2026-07-22 20:32:14.490863,2026-07-22 20:33:15.309661,0 days 00:01:00.818798,800,arctic-l,0.0,0.5329394791775399,1,True,0.7161458333333334,0.6951219512195121,0.6640625,0.676829268292683,0.6024553571428571,0.573170731707317,0.6024553571428571,0.573170731707317,0.6024553571428571,0.573170731707317,0.6024553571428571,0.573170731707317,0.52,0.6024553571428571,0.553030303030303,[-0.020000000000000018],60.66,1024.0,True,0.5,11198.0,16.0,132.0,False,1.0,0.0,0.49461706806520117,"{'v4': {'micro': 0.573170731707317, 'macro': 0.6024553571428571}, 'v3_legacy': {'micro': 0.573170731707317, 'macro': 0.6024553571428571}, 'equal': {'micro': 0.573170731707317, 'macro': 0.6024553571428571}, 'mrr_only': {'micro': 0.573170731707317, 'macro': 0.6024553571428571}}",218.0,[-0.020000000000000018],COMPLETE
219,,2026-07-22 20:33:15.323398,2026-07-22 20:33:23.318984,0 days 00:00:07.995586,800,arctic-l,0.15,0.5387181383736502,1,True,,,,,,,,,,,,,,,,[0.5],,,,,,,,,,,,,,[0.5],PRUNED
220,0.6395089285714286,2026-07-22 20:33:23.327303,2026-07-22 20:34:43.107806,0 days 00:01:19.780503,800,arctic-l,0.0,0.5137522344056122,1,True,0.7286458333333333,0.7073170731707317,0.6765625,0.6890243902439024,0.6395089285714286,0.6097560975609756,0.6395089285714286,0.6097560975609756,0.6395089285714286,0.6097560975609756,0.6395089285714286,0.6097560975609756,0.4,0.6395089285714286,0.5303030303030303,[0.09999999999999998],79.61,1024.0,False,0.5,11198.0,16.0,132.0,False,1.0,0.0,0.4878048780487805,"{'v4': {'micro': 0.6097560975609756, 'macro': 0.6395089285714286}, 'v3_legacy': {'micro': 0.6097560975609756, 'macro': 0.6395089285714286}, 'equal': {'micro': 0.6097560975609756, 'macro': 0.6395089285714286}, 'mrr_only': {'micro': 0.6097560975609756, 'macro': 0.6395089285714286}}",220.0,[0.09999999999999998],COMPLETE
221,0.6024553571428571,2026-07-22 20:34:43.122201,2026-07-22 20:35:46.528530,0 days 00:01:03.406329,800,arctic-l,0.0,0.5309081695575888,1,True,0.7161458333333334,0.6951219512195121,0.6640625,0.676829268292683,0.6024553571428571,0.573170731707317,0.6024553571428571,0.573170731707317,0.6024553571428571,0.573170731707317,0.6024553571428571,0.573170731707317,0.52,0.6024553571428571,0.553030303030303,[-0.020000000000000018],63.24,1024.0,True,0.5,11198.0,16.0,132.0,False,1.0,0.0,0.49461706806520117,"{'v4': {'micro': 0.573170731707317, 'macro': 0.6024553571428571}, 'v3_legacy': {'micro': 0.573170731707317, 'macro': 0.6024553571428571}, 'equal': {'micro': 0.573170731707317, 'macro': 0.6024553571428571}, 'mrr_only': {'micro': 0.573170731707317, 'macro': 0.6024553571428571}}",221.0,[-0.020000000000000018],COMPLETE
222,0.5816220238095238,2026-07-22 20:35:46.542888,2026-07-22 20:36:45.431390,0 days 00:00:58.888502,800,arctic-l,0.0,0.5349951188768961,1,True,0.6953125,0.6707317073170732,0.6432291666666666,0.6524390243902439,0.5816220238095238,0.5487804878048781,0.5816220238095238,0.5487804878048781,0.5816220238095238,0.5487804878048781,0.5816220238095238,0.5487804878048781,0.54,0.5816220238095238,0.5454545454545454,[-0.040000000000000036],58.73,1024.0,True,0.5,11198.0,16.0,132.0,False,1.0,0.0,0.4976147747098333,"{'v4': {'micro': 0.5487804878048781, 'macro': 0.5816220238095238}, 'v3_legacy': {'micro': 0.5487804878048781, 'macro': 0.5816220238095238}, 'equal': {'micro': 0.5487804878048781, 'macro': 0.5816220238095238}, 'mrr_only': {'micro': 0.5487804878048781, 'macro': 0.5816220238095238}}",222.0,[-0.040000000000000036],COMPLETE
223,0.5597470238095238,2026-07-22 20:36:45.445295,2026-07-22 20:37:18.975039,0 days 00:00:33.529744,800,arctic-l,0.0,0.5610701804088666,1,True,0.6415922619047619,0.6097560975609756,0.5895089285714286,0.5914634146341463,0.5597470238095238,0.524390243902439,0.5597470238095238,0.524390243902439,0.5597470238095238,0.524390243902439,0.5597470238095238,0.524390243902439,0.7,0.5597470238095238,0.5909090909090909,[-0.19999999999999996],33.29,1024.0,True,0.5,11198.0,16.0,132.0,False,1.0,0.0,0.4994047616937383,"{'v4': {'micro': 0.524390243902439, 'macro': 0.5597470238095238}, 'v3_legacy': {'micro': 0.524390243902439, 'macro': 0.5597470238095238}, 'equal': {'micro': 0.524390243902439, 'macro': 0.5597470238095238}, 'mrr_only': {'micro': 0.524390243902439, 'macro': 0.5597470238095238}}",223.0,[-0.19999999999999996],COMPLETE
224,0.6395089285714286,2026-07-22 20:37:18.989875,2026-07-22 20:38:35.364647,0 days 00:01:16.374772,800,arctic-l,0.0,0.5189765034410945,1,True,0.7286458333333333,0.7073170731707317,0.6765625,0.6890243902439024,0.6395089285714286,0.6097560975609756,0.6395089285714286,0.6097560975609756,0.6395089285714286,0.6097560975609756,0.6395089285714286,0.6097560975609756,0.46,0.6395089285714286,0.553030303030303,[0.03999999999999998],76.21,1024.0,False,0.5,11198.0,16.0,132.0,False,1.0,0.0,0.4878048780487805,"{'v4': {'micro': 0.6097560975609756, 'macro': 0.6395089285714286}, 'v3_legacy': {'micro': 0.6097560975609756, 'macro': 0.6395089285714286}, 'equal': {'micro': 0.6097560975609756, 'macro': 0.6395089285714286}, 'mrr_only': {'micro': 0.6097560975609756, 'macro': 0.6395089285714286}}",224.0,[0.03999999999999998],COMPLETE
225,0.5816220238095238,2026-07-22 20:38:35.378847,2026-07-22 20:39:28.754539,0 days 00:00:53.375692,800,arctic-l,0.0,0.5404528809014653,1,True,0.6863839285714286,0.6585365853658537,0.6343005952380952,0.6402439024390244,0.5816220238095238,0.5487804878048781,0.5816220238095238,0.5487804878048781,0.5816220238095238,0.5487804878048781,0.5816220238095238,0.5487804878048781,0.58,0.5816220238095238,0.5606060606060606,[-0.07999999999999996],53.22,1024.0,True,0.5,11198.0,16.0,132.0,False,1.0,0.0,0.4976147747098333,"{'v4': {'micro': 0.5487804878048781, 'macro': 0.5816220238095238}, 'v3_legacy': {'micro': 0.5487804878048781, 'macro': 0.5816220238095238}, 'equal': {'micro': 0.5487804878048781, 'macro': 0.5816220238095238}, 'mrr_only': {'micro': 0.5487804878048781, 'macro': 0.5816220238095238}}",225.0,[-0.07999999999999996],COMPLETE
226,0.5576636904761905,2026-07-22 20:39:28.768521,2026-07-22 20:40:01.647416,0 days 00:00:32.878895,800,arctic-l,0.0,0.562051774805918,1,True,0.6395089285714286,0.6097560975609756,0.5874255952380952,0.5914634146341463,0.5576636904761905,0.524390243902439,0.5576636904761905,0.524390243902439,0.5576636904761905,0.524390243902439,0.5576636904761905,0.524390243902439,0.7,0.5576636904761905,0.5909090909090909,[-0.19999999999999996],32.72,1024.0,True,0.5,11198.0,16.0,132.0,False,1.0,0.0,0.4994047616937383,"{'v4': {'micro': 0.524390243902439, 'macro': 0.5576636904761905}, 'v3_legacy': {'micro': 0.524390243902439, 'macro': 0.5576636904761905}, 'equal': {'micro': 0.524390243902439, 'macro': 0.5576636904761905}, 'mrr_only': {'micro': 0.524390243902439, 'macro': 0.5576636904761905}}",226.0,[-0.19999999999999996],COMPLETE
227,0.6395089285714286,2026-07-22 20:40:01.661063,2026-07-22 20:41:26.765295,0 days 00:01:25.104232,800,arctic-l,0.0,0.5060499643093991,1,True,0.7286458333333333,0.7073170731707317,0.6765625,0.6890243902439024,0.6395089285714286,0.6097560975609756,0.6395089285714286,0.6097560975609756,0.6395089285714286,0.6097560975609756,0.6395089285714286,0.6097560975609756,0.36,0.6395089285714286,0.5151515151515151,[0.14],84.9,1024.0,False,0.5,11198.0,16.0,132.0,False,1.0,0.0,0.4878048780487805,"{'v4': {'micro': 0.6097560975609756, 'macro': 0.6395089285714286}, 'v3_legacy': {'micro': 0.6097560975609756, 'macro': 0.6395089285714286}, 'equal': {'micro': 0.6097560975609756, 'macro': 0.6395089285714286}, 'mrr_only': {'micro': 0.6097560975609756, 'macro': 0.6395089285714286}}",227.0,[0.14],COMPLETE
228,,2026-07-22 20:41:26.780623,2026-07-22 20:41:34.567240,0 days 00:00:07.786617,800,e5-large,0.0,0.527731808478205,1,True,,,,,,,,,,,,,,,,[0.5],,,,,,,,,,,,,,[0.5],PRUNED
229,0.5941220238095238,2026-07-22 20:41:34.578538,2026-07-22 20:42:22.568595,0 days 00:00:47.990057,800,arctic-l,0.0,0.5464511868842428,1,True,0.6863839285714286,0.6585365853658537,0.6343005952380952,0.6402439024390244,0.5941220238095238,0.5609756097560976,0.5941220238095238,0.5609756097560976,0.5941220238095238,0.5609756097560976,0.5941220238095238,0.5609756097560976,0.58,0.5941220238095238,0.5681818181818182,[-0.07999999999999996],47.76,1024.0,True,0.5,11198.0,16.0,132.0,False,1.0,0.0,0.4962680475457513,"{'v4': {'micro': 0.5609756097560976, 'macro': 0.5941220238095238}, 'v3_legacy': {'micro': 0.5609756097560976, 'macro': 0.5941220238095238}, 'equal': {'micro': 0.5609756097560976, 'macro': 0.5941220238095238}, 'mrr_only': {'micro': 0.5609756097560976, 'macro': 0.5941220238095238}}",229.0,[-0.07999999999999996],COMPLETE
230,0.5680803571428571,2026-07-22 20:42:22.584124,2026-07-22 20:42:44.788398,0 days 00:00:22.204274,800,arctic-l,0.0,0.575072545585896,1,True,0.6499255952380952,0.6219512195121951,0.5978422619047619,0.6036585365853658,0.5680803571428571,0.5365853658536586,0.5680803571428571,0.5365853658536586,0.5680803571428571,0.5365853658536586,0.5680803571428571,0.5365853658536586,0.76,0.5680803571428571,0.6212121212121212,[-0.26],21.99,1024.0,True,0.5,11198.0,16.0,132.0,False,1.0,0.0,0.49865971464050907,"{'v4': {'micro': 0.5365853658536586, 'macro': 0.5680803571428571}, 'v3_legacy': {'micro': 0.5365853658536586, 'macro': 0.5680803571428571}, 'equal': {'micro': 0.5365853658536586, 'macro': 0.5680803571428571}, 'mrr_only': {'micro': 0.5365853658536586, 'macro': 0.5680803571428571}}",230.0,[-0.26],COMPLETE
231,0.5941220238095238,2026-07-22 20:42:44.803522,2026-07-22 20:43:32.260651,0 days 00:00:47.457129,800,arctic-l,0.0,0.5466959162132778,1,True,0.6863839285714286,0.6585365853658537,0.6343005952380952,0.6402439024390244,0.5941220238095238,0.5609756097560976,0.5941220238095238,0.5609756097560976,0.5941220238095238,0.5609756097560976,0.5941220238095238,0.5609756097560976,0.58,0.5941220238095238,0.5681818181818182,[-0.07999999999999996],47.21,1024.0,True,0.5,11198.0,16.0,132.0,False,1.0,0.0,0.4962680475457513,"{'v4': {'micro': 0.5609756097560976, 'macro': 0.5941220238095238}, 'v3_legacy': {'micro': 0.5609756097560976, 'macro': 0.5941220238095238}, 'equal': {'micro': 0.5609756097560976, 'macro': 0.5941220238095238}, 'mrr_only': {'micro': 0.5609756097560976, 'macro': 0.5941220238095238}}",231.0,[-0.07999999999999996],COMPLETE
232,0.5941220238095238,2026-07-22 20:43:32.276677,2026-07-22 20:44:16.309892,0 days 00:00:44.033215,800,arctic-l,0.0,0.5497303263638645,1,True,0.6863839285714286,0.6585365853658537,0.6343005952380952,0.6402439024390244,0.5941220238095238,0.5609756097560976,0.5941220238095238,0.5609756097560976,0.5941220238095238,0.5609756097560976,0.5941220238095238,0.5609756097560976,0.58,0.5941220238095238,0.5681818181818182,[-0.07999999999999996],43.81,1024.0,True,0.5,11198.0,16.0,132.0,False,1.0,0.0,0.4962680475457513,"{'v4': {'micro': 0.5609756097560976, 'macro': 0.5941220238095238}, 'v3_legacy': {'micro': 0.5609756097560976, 'macro': 0.5941220238095238}, 'equal': {'micro': 0.5609756097560976, 'macro': 0.5941220238095238}, 'mrr_only': {'micro': 0.5609756097560976, 'macro': 0.5941220238095238}}",232.0,[-0.07999999999999996],COMPLETE
233,0.5837053571428571,2026-07-22 20:44:16.325585,2026-07-22 20:44:59.448117,0 days 00:00:43.122532,800,arctic-l,0.0,0.5510639074495409,1,True,0.6759672619047619,0.6463414634146342,0.6238839285714286,0.6280487804878049,0.5837053571428571,0.5487804878048781,0.5837053571428571,0.5487804878048781,0.5837053571428571,0.5487804878048781,0.5837053571428571,0.5487804878048781,0.6,0.5837053571428571,0.5681818181818182,[-0.09999999999999998],42.9,1024.0,True,0.5,11198.0,16.0,132.0,False,1.0,0.0,0.4976147747098333,"{'v4': {'micro': 0.5487804878048781, 'macro': 0.5837053571428571}, 'v3_legacy': {'micro': 0.5487804878048781, 'macro': 0.5837053571428571}, 'equal': {'micro': 0.5487804878048781, 'macro': 0.5837053571428571}, 'mrr_only': {'micro': 0.5487804878048781, 'macro': 0.5837053571428571}}",233.0,[-0.09999999999999998],COMPLETE
234,0.5576636904761905,2026-07-22 20:44:59.463940,2026-07-22 20:45:30.930159,0 days 00:00:31.466219,800,arctic-l,0.0,0.5637757011342671,1,True,0.6395089285714286,0.6097560975609756,0.5874255952380952,0.5914634146341463,0.5576636904761905,0.524390243902439,0.5576636904761905,0.524390243902439,0.5576636904761905,0.524390243902439,0.5576636904761905,0.524390243902439,0.7,0.5576636904761905,0.5909090909090909,[-0.19999999999999996],31.26,1024.0,True,0.5,11198.0,16.0,132.0,False,1.0,0.0,0.4994047616937383,"{'v4': {'micro': 0.524390243902439, 'macro': 0.5576636904761905}, 'v3_legacy': {'micro': 0.524390243902439, 'macro': 0.5576636904761905}, 'equal': {'micro': 0.524390243902439, 'macro': 0.5576636904761905}, 'mrr_only': {'micro': 0.524390243902439, 'macro': 0.5576636904761905}}",234.0,[-0.19999999999999996],COMPLETE
235,0.5941220238095238,2026-07-22 20:45:30.945240,2026-07-22 20:46:16.962063,0 days 00:00:46.016823,800,arctic-l,0.0,0.5481540089772894,1,True,0.6863839285714286,0.6585365853658537,0.6343005952380952,0.6402439024390244,0.5941220238095238,0.5609756097560976,0.5941220238095238,0.5609756097560976,0.5941220238095238,0.5609756097560976,0.5941220238095238,0.5609756097560976,0.58,0.5941220238095238,0.5681818181818182,[-0.07999999999999996],45.81,1024.0,True,0.5,11198.0,16.0,132.0,False,1.0,0.0,0.4962680475457513,"{'v4': {'micro': 0.5609756097560976, 'macro': 0.5941220238095238}, 'v3_legacy': {'micro': 0.5609756097560976, 'macro': 0.5941220238095238}, 'equal': {'micro': 0.5609756097560976, 'macro': 0.5941220238095238}, 'mrr_only': {'micro': 0.5609756097560976, 'macro': 0.5941220238095238}}",235.0,[-0.07999999999999996],COMPLETE
236,0.4466517857142857,2026-07-22 20:46:16.977684,2026-07-22 20:46:19.653623,0 days 00:00:02.675939,800,arctic-l,0.0,0.5396883205631189,1,False,0.5936011904761904,0.5487804878048781,0.5415178571428572,0.5304878048780488,0.44821428571428573,0.4024390243902439,0.44821428571428573,0.4024390243902439,0.44821428571428573,0.4024390243902439,0.43779761904761905,0.39634146341463417,0.58,0.4466517857142857,0.46856060606060607,[-0.07999999999999996],2.46,1024.0,True,0.5,11198.0,16.0,132.0,False,1.0,0.0,0.48934294487383684,"{'v4': {'micro': 0.4015243902439024, 'macro': 0.4466517857142857}, 'v3_legacy': {'micro': 0.400609756097561, 'macro': 0.4450892857142857}, 'equal': {'micro': 0.4004065040650407, 'macro': 0.44474206349206347}, 'mrr_only': {'micro': 0.4024390243902439, 'macro': 0.44821428571428573}}",236.0,[-0.07999999999999996],COMPLETE
237,,2026-07-22 20:46:19.668980,2026-07-22 20:46:27.695753,0 days 00:00:08.026773,800,arctic-l,0.3,0.5736740538034395,1,True,,,,,,,,,,,,,,,,[0.5],,,,,,,,,,,,,,[0.5],PRUNED
238,0.5139136904761905,2026-07-22 20:46:27.704188,2026-07-22 20:46:59.081269,0 days 00:00:31.377081,256,arctic-l,0.0,0.5551052063154792,1,True,0.7202380952380952,0.7195121951219512,0.6785714285714286,0.7073170731707317,0.5139136904761905,0.524390243902439,0.5139136904761905,0.524390243902439,0.5139136904761905,0.524390243902439,0.5139136904761905,0.524390243902439,0.6,0.5139136904761905,0.553030303030303,[-0.09999999999999998],31.12,1024.0,True,0.5,28876.0,16.0,132.0,False,1.0,0.0,0.4994047616937383,"{'v4': {'micro': 0.524390243902439, 'macro': 0.5139136904761905}, 'v3_legacy': {'micro': 0.524390243902439, 'macro': 0.5139136904761905}, 'equal': {'micro': 0.524390243902439, 'macro': 0.5139136904761905}, 'mrr_only': {'micro': 0.524390243902439, 'macro': 0.5139136904761905}}",238.0,[-0.09999999999999998],COMPLETE
239,0.6395089285714286,2026-07-22 20:46:59.099027,2026-07-22 20:48:09.907442,0 days 00:01:10.808415,800,arctic-l,0.0,0.5250307406573581,1,True,0.7286458333333333,0.7073170731707317,0.6765625,0.6890243902439024,0.6395089285714286,0.6097560975609756,0.6395089285714286,0.6097560975609756,0.6395089285714286,0.6097560975609756,0.6395089285714286,0.6097560975609756,0.48,0.6395089285714286,0.5606060606060606,[0.020000000000000018],70.58,1024.0,False,0.5,11198.0,16.0,132.0,False,1.0,0.0,0.4878048780487805,"{'v4': {'micro': 0.6097560975609756, 'macro': 0.6395089285714286}, 'v3_legacy': {'micro': 0.6097560975609756, 'macro': 0.6395089285714286}, 'equal': {'micro': 0.6097560975609756, 'macro': 0.6395089285714286}, 'mrr_only': {'micro': 0.6097560975609756, 'macro': 0.6395089285714286}}",239.0,[0.020000000000000018],COMPLETE
240,,2026-07-22 20:48:09.927364,2026-07-22 20:48:17.652607,0 days 00:00:07.725243,800,bge-m3,0.0,0.5395725895573162,1,True,,,,,,,,,,,,,,,,[0.5],,,,,,,,,,,,,,[0.5],PRUNED
241,0.5941220238095238,2026-07-22 20:48:17.662395,2026-07-22 20:49:07.905077,0 days 00:00:50.242682,800,arctic-l,0.0,0.5439921876924786,1,True,0.6863839285714286,0.6585365853658537,0.6343005952380952,0.6402439024390244,0.5941220238095238,0.5609756097560976,0.5941220238095238,0.5609756097560976,0.5941220238095238,0.5609756097560976,0.5941220238095238,0.5609756097560976,0.58,0.5941220238095238,0.5681818181818182,[-0.07999999999999996],50.02,1024.0,True,0.5,11198.0,16.0,132.0,False,1.0,0.0,0.4962680475457513,"{'v4': {'micro': 0.5609756097560976, 'macro': 0.5941220238095238}, 'v3_legacy': {'micro': 0.5609756097560976, 'macro': 0.5941220238095238}, 'equal': {'micro': 0.5609756097560976, 'macro': 0.5941220238095238}, 'mrr_only': {'micro': 0.5609756097560976, 'macro': 0.5941220238095238}}",241.0,[-0.07999999999999996],COMPLETE
242,0.5962053571428572,2026-07-22 20:49:07.921527,2026-07-22 20:49:45.909122,0 days 00:00:37.987595,800,arctic-l,0.0,0.5564159326687252,1,True,0.6884672619047619,0.6585365853658537,0.6363839285714286,0.6402439024390244,0.5962053571428572,0.5609756097560976,0.5962053571428572,0.5609756097560976,0.5962053571428572,0.5609756097560976,0.5962053571428572,0.5609756097560976,0.62,0.5962053571428572,0.5833333333333334,[-0.12],37.77,1024.0,True,0.5,11198.0,16.0,132.0,False,1.0,0.0,0.4962680475457513,"{'v4': {'micro': 0.5609756097560976, 'macro': 0.5962053571428572}, 'v3_legacy': {'micro': 0.5609756097560976, 'macro': 0.5962053571428572}, 'equal': {'micro': 0.5609756097560976, 'macro': 0.5962053571428572}, 'mrr_only': {'micro': 0.5609756097560976, 'macro': 0.5962053571428572}}",242.0,[-0.12],COMPLETE
