number,value,datetime_start,datetime_complete,duration,params_chunk_size,params_embedding_model,params_overlap_ratio,params_similarity_threshold,params_top_k,params_use_reranker,user_attrs_avg_doc_mrr_in_scope_macro,user_attrs_avg_doc_mrr_in_scope_micro,user_attrs_avg_doc_recall_in_scope_macro,user_attrs_avg_doc_recall_in_scope_micro,user_attrs_avg_mrr_in_scope_macro,user_attrs_avg_mrr_in_scope_micro,user_attrs_avg_ndcg_in_scope_macro,user_attrs_avg_ndcg_in_scope_micro,user_attrs_avg_precision_in_scope_macro,user_attrs_avg_precision_in_scope_micro,user_attrs_avg_recall_in_scope_macro,user_attrs_avg_recall_in_scope_micro,user_attrs_avg_score_hors_perimetre,user_attrs_avg_score_in_scope_macro,user_attrs_avg_score_v3_replica,user_attrs_constraint,user_attrs_duration_seconds,user_attrs_embedding_dim,user_attrs_hors_perimetre_constraint_satisfied,user_attrs_hors_perimetre_min_required,user_attrs_num_chunks,user_attrs_num_docs_in_scope_evaluated,user_attrs_num_questions_evaluated,user_attrs_pruned_early,user_attrs_score_max,user_attrs_score_min,user_attrs_score_std,user_attrs_score_variants,user_attrs_trial_number,system_attrs_constraints,state
127,0.38833333333333336,2026-07-22 19:14:44.823753,2026-07-22 19:15:29.378456,0 days 00:00:44.554703,800,miniLM,0.25,0.5902147268561588,2,True,0.525,0.5666666666666667,0.525,0.5666666666666667,0.375,0.43333333333333335,0.44463946303571866,0.48412396714286104,0.25,0.26666666666666666,0.4,0.4666666666666667,0.0,0.34125000000000005,0.28095238095238095,[0.5],44.09,384.0,False,0.5,11586.0,10.0,21.0,True,1.0,0.0,0.42277522265252127,"{'v4': {'micro': 0.38833333333333336, 'macro': 0.34125000000000005}, 'v3_legacy': {'micro': 0.39333333333333337, 'macro': 0.34500000000000003}, 'equal': {'micro': 0.3888888888888889, 'macro': 0.3416666666666667}, 'mrr_only': {'micro': 0.43333333333333335, 'macro': 0.375}}",127.0,[0.5],PRUNED
128,0.49828869047619045,2026-07-22 19:15:29.387801,2026-07-22 19:20:28.245429,0 days 00:04:58.857628,256,e5-base,0.0,0.613279903467214,1,True,0.6852678571428571,0.6707317073170732,0.6436011904761905,0.6585365853658537,0.49828869047619045,0.5,0.49828869047619045,0.5,0.49828869047619045,0.5,0.49828869047619045,0.5,0.0,0.49828869047619045,0.3106060606060606,[0.5],298.7,768.0,False,0.5,28876.0,16.0,132.0,False,1.0,0.0,0.5,"{'v4': {'micro': 0.5, 'macro': 0.49828869047619045}, 'v3_legacy': {'micro': 0.5, 'macro': 0.49828869047619045}, 'equal': {'micro': 0.5, 'macro': 0.49828869047619045}, 'mrr_only': {'micro': 0.5, 'macro': 0.49828869047619045}}",128.0,[0.5],COMPLETE
129,,2026-07-22 19:20:28.259731,2026-07-22 19:20:38.928226,0 days 00:00:10.668495,1024,arctic-l,0.0,0.5270153837138126,2,True,,,,,,,,,,,,,,,,[0.5],,,,,,,,,,,,,,[0.5],PRUNED
130,0.5828776041666667,2026-07-22 19:20:38.937166,2026-07-22 19:21:16.165287,0 days 00:00:37.228121,800,arctic-l,0.0,0.5600158608965125,2,True,0.7001860119047619,0.676829268292683,0.7066964285714286,0.7195121951219512,0.6261532738095238,0.6036585365853658,0.6605312333054357,0.636610814590597,0.45390625,0.42073170731707316,0.6821428571428572,0.6707317073170732,0.7,0.5828776041666667,0.6185606060606061,[-0.19999999999999996],37.03,1024.0,True,0.5,11198.0,16.0,132.0,False,1.0,0.0,0.4087900787992386,"{'v4': {'micro': 0.5588414634146341, 'macro': 0.5828776041666667}, 'v3_legacy': {'micro': 0.5689024390243902, 'macro': 0.5912760416666667}, 'equal': {'micro': 0.565040650406504, 'macro': 0.5874007936507936}, 'mrr_only': {'micro': 0.6036585365853658, 'macro': 0.6261532738095238}}",130.0,[-0.19999999999999996],COMPLETE
131,0.5801692708333334,2026-07-22 19:21:16.179209,2026-07-22 19:22:09.593416,0 days 00:00:53.414207,800,arctic-l,0.0,0.5425888315086334,2,True,0.7356026785714286,0.7134146341463414,0.7431547619047619,0.7560975609756098,0.6459449404761904,0.6219512195121951,0.6616257031732173,0.6562833413316391,0.40078125,0.39634146341463417,0.6977678571428572,0.6829268292682927,0.58,0.5801692708333334,0.5753787878787879,[-0.07999999999999996],53.25,1024.0,True,0.5,11198.0,16.0,132.0,False,1.0,0.0,0.3983042393735158,"{'v4': {'micro': 0.5634146341463415, 'macro': 0.5801692708333334}, 'v3_legacy': {'micro': 0.5725609756097562, 'macro': 0.5879427083333333}, 'equal': {'micro': 0.5670731707317073, 'macro': 0.5814980158730159}, 'mrr_only': {'micro': 0.6219512195121951, 'macro': 0.6459449404761904}}",131.0,[-0.07999999999999996],COMPLETE
132,0.6114006696428572,2026-07-22 19:22:09.607880,2026-07-22 19:23:42.125447,0 days 00:01:32.517567,800,arctic-l,0.0,0.5046571394910376,2,True,0.7690104166666667,0.7560975609756098,0.7572916666666667,0.7804878048780488,0.6920758928571429,0.6707317073170732,0.7035321028693287,0.7003461119751203,0.3976190476190476,0.3902439024390244,0.7431547619047619,0.7317073170731707,0.36,0.6114006696428572,0.5121212121212121,[0.14],92.36,1024.0,False,0.5,11198.0,16.0,132.0,False,1.0,0.0,0.3735093314790986,"{'v4': {'micro': 0.5957317073170731, 'macro': 0.6114006696428572}, 'v3_legacy': {'micro': 0.6048780487804878, 'macro': 0.6190625}, 'equal': {'micro': 0.597560975609756, 'macro': 0.6109499007936507}, 'mrr_only': {'micro': 0.6707317073170732, 'macro': 0.6920758928571429}}",132.0,[0.14],COMPLETE
133,0.5976171875,2026-07-22 19:23:42.139214,2026-07-22 19:24:27.083107,0 days 00:00:44.943893,800,arctic-l,0.0,0.5496914699362917,2,True,0.740811011904762,0.7195121951219512,0.7535714285714286,0.7682926829268293,0.6563616071428572,0.6341463414634146,0.6747700730392894,0.6716718719065526,0.42942708333333335,0.42073170731707316,0.7186011904761904,0.7073170731707317,0.58,0.5976171875,0.5875,[-0.07999999999999996],44.79,1024.0,True,0.5,11198.0,16.0,132.0,False,1.0,0.0,0.3914591406194764,"{'v4': {'micro': 0.5810975609756098, 'macro': 0.5976171875}, 'v3_legacy': {'micro': 0.5920731707317073, 'macro': 0.606953125}, 'equal': {'micro': 0.5873983739837398, 'macro': 0.6014632936507937}, 'mrr_only': {'micro': 0.6341463414634146, 'macro': 0.6563616071428572}}",133.0,[-0.07999999999999996],COMPLETE
134,0.5451841517857143,2026-07-22 19:24:27.096578,2026-07-22 19:24:45.907352,0 days 00:00:18.810774,800,arctic-l,0.0,0.5820247402864996,2,True,0.6568080357142857,0.6402439024390244,0.6398809523809523,0.6585365853658537,0.5853794642857143,0.5670731707317073,0.6143020173828154,0.5936386314895502,0.43381696428571426,0.4024390243902439,0.6205357142857143,0.6097560975609756,0.78,0.5451841517857143,0.625,[-0.28],18.65,1024.0,True,0.5,11198.0,16.0,132.0,False,1.0,0.0,0.43194549117546926,"{'v4': {'micro': 0.5240853658536585, 'macro': 0.5451841517857143}, 'v3_legacy': {'micro': 0.5304878048780488, 'macro': 0.5504575892857143}, 'equal': {'micro': 0.5264227642276422, 'macro': 0.546577380952381}, 'mrr_only': {'micro': 0.5670731707317073, 'macro': 0.5853794642857143}}",134.0,[-0.28],COMPLETE
135,,2026-07-22 19:24:45.921550,2026-07-22 19:25:37.996867,0 days 00:00:52.075317,800,arctic-l,0.4,0.5274434873367969,2,True,,,,,,,,,,,,,,,,[0.5],,,,,,,,,,,,,,[0.5],PRUNED
136,0.5647005208333333,2026-07-22 19:25:38.008841,2026-07-22 19:26:11.046585,0 days 00:00:33.037744,800,arctic-l,0.0,0.5621694832533477,2,True,0.6824776785714286,0.6585365853658537,0.6837797619047619,0.6951219512195121,0.6084449404761905,0.5853658536585366,0.6414590483723996,0.6167214273519206,0.43723958333333335,0.4024390243902439,0.6592261904761905,0.6463414634146342,0.7,0.5647005208333333,0.6060606060606061,[-0.19999999999999996],32.8,1024.0,True,0.5,11198.0,16.0,132.0,False,1.0,0.0,0.41470587614847726,"{'v4': {'micro': 0.5396341463414634, 'macro': 0.5647005208333333}, 'v3_legacy': {'micro': 0.5487804878048781, 'macro': 0.5723177083333334}, 'equal': {'micro': 0.5447154471544715, 'macro': 0.5683035714285714}, 'mrr_only': {'micro': 0.5853658536585366, 'macro': 0.6084449404761905}}",136.0,[-0.19999999999999996],COMPLETE
137,0.38833333333333336,2026-07-22 19:26:11.061085,2026-07-22 19:26:30.863941,0 days 00:00:19.802856,800,e5-small,0.0,0.22740047646090525,2,True,0.475,0.5,0.475,0.5,0.375,0.43333333333333335,0.44463946303571866,0.48412396714286104,0.25,0.26666666666666666,0.4,0.4666666666666667,0.0,0.34125000000000005,0.28095238095238095,[0.5],19.62,384.0,False,0.5,11198.0,10.0,21.0,True,1.0,0.0,0.42277522265252127,"{'v4': {'micro': 0.38833333333333336, 'macro': 0.34125000000000005}, 'v3_legacy': {'micro': 0.39333333333333337, 'macro': 0.34500000000000003}, 'equal': {'micro': 0.3888888888888889, 'macro': 0.3416666666666667}, 'mrr_only': {'micro': 0.43333333333333335, 'macro': 0.375}}",137.0,[0.5],PRUNED
138,,2026-07-22 19:26:30.873760,2026-07-22 19:28:09.108830,0 days 00:01:38.235070,512,arctic-l,0.0,0.5971993838205196,2,False,,,,,,,,,,,,,,,,[0.5],,,,,,,,,,,,,,[0.5],PRUNED
139,0.5941220238095238,2026-07-22 19:28:09.118044,2026-07-22 19:28:56.464055,0 days 00:00:47.346011,800,arctic-l,0.0,0.5470116562705188,1,True,0.6863839285714286,0.6585365853658537,0.6343005952380952,0.6402439024390244,0.5941220238095238,0.5609756097560976,0.5941220238095238,0.5609756097560976,0.5941220238095238,0.5609756097560976,0.5941220238095238,0.5609756097560976,0.58,0.5941220238095238,0.5681818181818182,[-0.07999999999999996],47.12,1024.0,True,0.5,11198.0,16.0,132.0,False,1.0,0.0,0.4962680475457513,"{'v4': {'micro': 0.5609756097560976, 'macro': 0.5941220238095238}, 'v3_legacy': {'micro': 0.5609756097560976, 'macro': 0.5941220238095238}, 'equal': {'micro': 0.5609756097560976, 'macro': 0.5941220238095238}, 'mrr_only': {'micro': 0.5609756097560976, 'macro': 0.5941220238095238}}",139.0,[-0.07999999999999996],COMPLETE
140,,2026-07-22 19:28:56.479240,2026-07-22 19:29:04.549136,0 days 00:00:08.069896,800,arctic-l,0.15,0.5169930666880864,1,True,,,,,,,,,,,,,,,,[0.5],,,,,,,,,,,,,,[0.5],PRUNED
141,0.5837053571428571,2026-07-22 19:29:04.557625,2026-07-22 19:29:47.820436,0 days 00:00:43.262811,800,arctic-l,0.0,0.5509456756507862,1,True,0.6759672619047619,0.6463414634146342,0.6238839285714286,0.6280487804878049,0.5837053571428571,0.5487804878048781,0.5837053571428571,0.5487804878048781,0.5837053571428571,0.5487804878048781,0.5837053571428571,0.5487804878048781,0.6,0.5837053571428571,0.5681818181818182,[-0.09999999999999998],43.06,1024.0,True,0.5,11198.0,16.0,132.0,False,1.0,0.0,0.4976147747098333,"{'v4': {'micro': 0.5487804878048781, 'macro': 0.5837053571428571}, 'v3_legacy': {'micro': 0.5487804878048781, 'macro': 0.5837053571428571}, 'equal': {'micro': 0.5487804878048781, 'macro': 0.5837053571428571}, 'mrr_only': {'micro': 0.5487804878048781, 'macro': 0.5837053571428571}}",141.0,[-0.09999999999999998],COMPLETE
142,0.5816220238095238,2026-07-22 19:29:47.834547,2026-07-22 19:30:42.186927,0 days 00:00:54.352380,800,arctic-l,0.0,0.5396475169908364,1,True,0.6863839285714286,0.6585365853658537,0.6343005952380952,0.6402439024390244,0.5816220238095238,0.5487804878048781,0.5816220238095238,0.5487804878048781,0.5816220238095238,0.5487804878048781,0.5816220238095238,0.5487804878048781,0.58,0.5816220238095238,0.5606060606060606,[-0.07999999999999996],54.16,1024.0,True,0.5,11198.0,16.0,132.0,False,1.0,0.0,0.4976147747098333,"{'v4': {'micro': 0.5487804878048781, 'macro': 0.5816220238095238}, 'v3_legacy': {'micro': 0.5487804878048781, 'macro': 0.5816220238095238}, 'equal': {'micro': 0.5487804878048781, 'macro': 0.5816220238095238}, 'mrr_only': {'micro': 0.5487804878048781, 'macro': 0.5816220238095238}}",142.0,[-0.07999999999999996],COMPLETE
143,0.5576636904761905,2026-07-22 19:30:42.202754,2026-07-22 19:31:06.796980,0 days 00:00:24.594226,800,arctic-l,0.0,0.5721771891324638,1,True,0.6395089285714286,0.6097560975609756,0.5874255952380952,0.5914634146341463,0.5576636904761905,0.524390243902439,0.5576636904761905,0.524390243902439,0.5576636904761905,0.524390243902439,0.5576636904761905,0.524390243902439,0.74,0.5576636904761905,0.6060606060606061,[-0.24],24.4,1024.0,True,0.5,11198.0,16.0,132.0,False,1.0,0.0,0.4994047616937383,"{'v4': {'micro': 0.524390243902439, 'macro': 0.5576636904761905}, 'v3_legacy': {'micro': 0.524390243902439, 'macro': 0.5576636904761905}, 'equal': {'micro': 0.524390243902439, 'macro': 0.5576636904761905}, 'mrr_only': {'micro': 0.524390243902439, 'macro': 0.5576636904761905}}",143.0,[-0.24],COMPLETE
144,0.6114006696428572,2026-07-22 19:31:06.811962,2026-07-22 19:32:39.928701,0 days 00:01:33.116739,800,arctic-l,0.0,0.5037883609663135,2,True,0.7690104166666667,0.7560975609756098,0.7572916666666667,0.7804878048780488,0.6920758928571429,0.6707317073170732,0.7035321028693287,0.7003461119751203,0.3976190476190476,0.3902439024390244,0.7431547619047619,0.7317073170731707,0.36,0.6114006696428572,0.5121212121212121,[0.14],92.92,1024.0,False,0.5,11198.0,16.0,132.0,False,1.0,0.0,0.3735093314790986,"{'v4': {'micro': 0.5957317073170731, 'macro': 0.6114006696428572}, 'v3_legacy': {'micro': 0.6048780487804878, 'macro': 0.6190625}, 'equal': {'micro': 0.597560975609756, 'macro': 0.6109499007936507}, 'mrr_only': {'micro': 0.6707317073170732, 'macro': 0.6920758928571429}}",144.0,[0.14],COMPLETE
145,0.5433270089285714,2026-07-22 19:32:39.943356,2026-07-22 19:33:13.542392,0 days 00:00:33.599036,800,arctic-l,0.0,0.561280775391702,5,True,0.6958457341269841,0.6717479674796748,0.7171130952380952,0.7317073170731707,0.6157366071428572,0.5914634146341463,0.6679710600625341,0.6474260927276035,0.3463764880952381,0.30853658536585366,0.6717261904761904,0.6585365853658537,0.7,0.5433270089285714,0.5923484848484848,[-0.19999999999999996],33.4,1024.0,True,0.5,11198.0,16.0,132.0,False,1.0,0.0,0.39491821851604086,"{'v4': {'micro': 0.5166463414634147, 'macro': 0.5433270089285714}, 'v3_legacy': {'micro': 0.5267073170731708, 'macro': 0.5517254464285715}, 'equal': {'micro': 0.5195121951219512, 'macro': 0.5446130952380952}, 'mrr_only': {'micro': 0.5914634146341463, 'macro': 0.6157366071428572}}",145.0,[-0.19999999999999996],COMPLETE
146,,2026-07-22 19:33:13.558395,2026-07-22 19:33:21.297617,0 days 00:00:07.739222,800,e5-large,0.0,0.5253687128493273,2,True,,,,,,,,,,,,,,,,[0.5],,,,,,,,,,,,,,[0.5],PRUNED
147,0.6305803571428571,2026-07-22 19:33:21.307162,2026-07-22 19:35:05.589404,0 days 00:01:44.282242,800,arctic-l,0.0,0.4825897218216786,1,True,0.7286458333333333,0.7073170731707317,0.6765625,0.6890243902439024,0.6305803571428571,0.5975609756097561,0.6305803571428571,0.5975609756097561,0.6305803571428571,0.5975609756097561,0.6305803571428571,0.5975609756097561,0.34,0.6305803571428571,0.5,[0.15999999999999998],104.11,1024.0,False,0.5,11198.0,16.0,132.0,False,1.0,0.0,0.490389494216661,"{'v4': {'micro': 0.5975609756097561, 'macro': 0.6305803571428571}, 'v3_legacy': {'micro': 0.5975609756097561, 'macro': 0.6305803571428571}, 'equal': {'micro': 0.5975609756097561, 'macro': 0.6305803571428571}, 'mrr_only': {'micro': 0.5975609756097561, 'macro': 0.6305803571428571}}",147.0,[0.15999999999999998],COMPLETE
148,0.5140290178571428,2026-07-22 19:35:05.603533,2026-07-22 19:35:20.843233,0 days 00:00:15.239700,800,arctic-l,0.0,0.5901644781988198,4,True,0.6487475198412699,0.6260162601626017,0.6231398809523809,0.6341463414634146,0.5686383928571429,0.5426829268292683,0.5983555395554333,0.5689591313153328,0.3794456845238095,0.3363821138211382,0.5829613095238095,0.5609756097560976,0.84,0.5140290178571428,0.6202651515151515,[-0.33999999999999997],15.04,1024.0,True,0.5,11198.0,16.0,132.0,False,1.0,0.0,0.43857827944176214,"{'v4': {'micro': 0.48353658536585364, 'macro': 0.5140290178571428}, 'v3_legacy': {'micro': 0.48628048780487804, 'macro': 0.5161774553571429}, 'equal': {'micro': 0.4800135501355013, 'macro': 0.5103484623015873}, 'mrr_only': {'micro': 0.5426829268292683, 'macro': 0.5686383928571429}}",148.0,[-0.33999999999999997],COMPLETE
149,,2026-07-22 19:35:20.858295,2026-07-22 19:35:28.882013,0 days 00:00:08.023718,800,arctic-l,0.3,0.5455705779759479,2,True,,,,,,,,,,,,,,,,[0.5],,,,,,,,,,,,,,[0.5],PRUNED
150,,2026-07-22 19:35:28.892574,2026-07-22 19:35:29.040469,0 days 00:00:00.147895,800,bge-m3,0.0,0.6046611914404088,2,True,,,,,,,,,,,,,,,,[0.5],,,,,,,,,,,,,,[0.5],PRUNED
151,0.5976171875,2026-07-22 19:35:29.049990,2026-07-22 19:36:14.691513,0 days 00:00:45.641523,800,arctic-l,0.0,0.5496247741619741,2,True,0.740811011904762,0.7195121951219512,0.7535714285714286,0.7682926829268293,0.6563616071428572,0.6341463414634146,0.6747700730392894,0.6716718719065526,0.42942708333333335,0.42073170731707316,0.7186011904761904,0.7073170731707317,0.58,0.5976171875,0.5875,[-0.07999999999999996],45.44,1024.0,True,0.5,11198.0,16.0,132.0,False,1.0,0.0,0.3914591406194764,"{'v4': {'micro': 0.5810975609756098, 'macro': 0.5976171875}, 'v3_legacy': {'micro': 0.5920731707317073, 'macro': 0.606953125}, 'equal': {'micro': 0.5873983739837398, 'macro': 0.6014632936507937}, 'mrr_only': {'micro': 0.6341463414634146, 'macro': 0.6563616071428572}}",151.0,[-0.07999999999999996],COMPLETE
152,0.5726023065476191,2026-07-22 19:36:14.706888,2026-07-22 19:36:38.389821,0 days 00:00:23.682933,800,arctic-l,0.0,0.5732862308620624,2,True,0.6798735119047619,0.6585365853658537,0.6785714285714286,0.6951219512195121,0.6084449404761905,0.5853658536585366,0.6414590483723996,0.6167214273519206,0.463578869047619,0.4268292682926829,0.6592261904761905,0.6463414634146342,0.74,0.5726023065476191,0.6257575757575757,[-0.24],23.48,1024.0,True,0.5,11198.0,16.0,132.0,False,1.0,0.0,0.4213869058830997,"{'v4': {'micro': 0.5469512195121952, 'macro': 0.5726023065476191}, 'v3_legacy': {'micro': 0.5560975609756098, 'macro': 0.5802194940476191}, 'equal': {'micro': 0.5528455284552845, 'macro': 0.5770833333333333}, 'mrr_only': {'micro': 0.5853658536585366, 'macro': 0.6084449404761905}}",152.0,[-0.24],COMPLETE
153,0.5826209077380953,2026-07-22 19:36:38.404803,2026-07-22 19:37:42.959897,0 days 00:01:04.555094,800,arctic-l,0.0,0.532559266264564,2,True,0.7513020833333334,0.7378048780487805,0.7447916666666666,0.7682926829268293,0.6542782738095239,0.6341463414634146,0.6699590365065508,0.6684784632828585,0.38950892857142855,0.38414634146341464,0.7061011904761905,0.6951219512195121,0.52,0.5826209077380953,0.5556818181818182,[-0.020000000000000018],64.34,1024.0,True,0.5,11198.0,16.0,132.0,False,1.0,0.0,0.389595020746368,"{'v4': {'micro': 0.5682926829268293, 'macro': 0.5826209077380953}, 'v3_legacy': {'micro': 0.577439024390244, 'macro': 0.5903943452380952}, 'equal': {'micro': 0.5711382113821137, 'macro': 0.5832961309523809}, 'mrr_only': {'micro': 0.6341463414634146, 'macro': 0.6542782738095239}}",153.0,[-0.020000000000000018],COMPLETE
154,0.5810026041666667,2026-07-22 19:37:42.975301,2026-07-22 19:38:19.006164,0 days 00:00:36.030863,800,arctic-l,0.0,0.5579623443695283,2,True,0.7262276785714286,0.7012195121951219,0.7327380952380952,0.7439024390243902,0.6261532738095238,0.6036585365853658,0.6605312333054357,0.636610814590597,0.44765625,0.4146341463414634,0.6821428571428572,0.6707317073170732,0.62,0.5810026041666667,0.5871212121212122,[-0.12],35.81,1024.0,True,0.5,11198.0,16.0,132.0,False,1.0,0.0,0.4071441733588478,"{'v4': {'micro': 0.5570121951219513, 'macro': 0.5810026041666667}, 'v3_legacy': {'micro': 0.5670731707317073, 'macro': 0.5894010416666666}, 'equal': {'micro': 0.5630081300813008, 'macro': 0.5853174603174602}, 'mrr_only': {'micro': 0.6036585365853658, 'macro': 0.6261532738095238}}",154.0,[-0.12],COMPLETE
155,0.610991443452381,2026-07-22 19:38:19.021313,2026-07-22 19:39:41.468242,0 days 00:01:22.446929,800,arctic-l,0.0,0.5163693122930122,2,True,0.77421875,0.7621951219512195,0.7677083333333333,0.7926829268292683,0.6913318452380952,0.6707317073170732,0.7029828911930956,0.7003461119751203,0.3976190476190476,0.3902439024390244,0.7431547619047619,0.7317073170731707,0.44,0.610991443452381,0.5424242424242424,[0.06],82.26,1024.0,False,0.5,11198.0,16.0,132.0,False,1.0,0.0,0.3735093314790986,"{'v4': {'micro': 0.5957317073170731, 'macro': 0.610991443452381}, 'v3_legacy': {'micro': 0.6048780487804878, 'macro': 0.6187648809523809}, 'equal': {'micro': 0.597560975609756, 'macro': 0.6107018849206349}, 'mrr_only': {'micro': 0.6707317073170732, 'macro': 0.6913318452380952}}",155.0,[0.06],COMPLETE
156,0.5753924851190477,2026-07-22 19:39:41.482698,2026-07-22 19:40:35.977848,0 days 00:00:54.495150,800,arctic-l,0.0,0.5411886835896542,2,True,0.7356026785714286,0.7134146341463414,0.7431547619047619,0.7560975609756098,0.6396949404761905,0.6158536585365854,0.6570123250928606,0.6517824846678764,0.3963169642857143,0.3902439024390244,0.6977678571428572,0.6829268292682927,0.58,0.5753924851190477,0.5727272727272726,[-0.07999999999999996],54.32,1024.0,True,0.5,11198.0,16.0,132.0,False,1.0,0.0,0.39534360784378286,"{'v4': {'micro': 0.5582317073170733, 'macro': 0.5753924851190477}, 'v3_legacy': {'micro': 0.5682926829268293, 'macro': 0.5841034226190476}, 'equal': {'micro': 0.5630081300813008, 'macro': 0.5779265873015873}, 'mrr_only': {'micro': 0.6158536585365854, 'macro': 0.6396949404761905}}",156.0,[-0.07999999999999996],COMPLETE
157,0.29625,2026-07-22 19:40:35.991949,2026-07-22 19:40:47.209781,0 days 00:00:11.217832,256,miniLM,0.25,0.6209818761778275,10,True,0.4083333333333333,0.41111111111111115,0.45,0.4666666666666667,0.35625,0.375,0.48201069433677696,0.4918902919728417,0.065,0.06666666666666667,0.45,0.4666666666666667,0.0,0.2829375,0.22142857142857145,[0.5],11.04,384.0,False,0.5,30525.0,10.0,21.0,True,0.76,0.0,0.33883778075454735,"{'v4': {'micro': 0.29625, 'macro': 0.2829375}, 'v3_legacy': {'micro': 0.31, 'macro': 0.29700000000000004}, 'equal': {'micro': 0.30277777777777776, 'macro': 0.29041666666666666}, 'mrr_only': {'micro': 0.375, 'macro': 0.35625}}",157.0,[0.5],PRUNED
